22:50:18.785100 IP 10.34.1.208.53645 > 172.217.9.138.443: Flags [.], seq 1616714473:1616715841, ack 1811520974, win 2048, options [nop,nop,TS val 1330161552 ecr 1488063449], length 1368
22:50:18.785104 IP 10.34.1.208.53645 > 172.217.9.138.443: Flags [.], seq 1368:2736, ack 1, win 2048, options [nop,nop,TS val 1330161552 ecr 1488063449], length 1368
22:50:18.785105 IP 10.34.1.208.53645 > 172.217.9.138.443: Flags [.], seq 2736:4104, ack 1, win 2048, options [nop,nop,TS val 1330161552 ecr 1488063449], length 1368
22:50:18.785107 IP 10.34.1.208.53645 > 172.217.9.138.443: Flags [.], seq 4104:5472, ack 1, win 2048, options [nop,nop,TS val 1330161552 ecr 1488063449], length 1368
22:50:18.785108 IP 10.34.1.208.53645 > 172.217.9.138.443: Flags [.], seq 5472:6840, ack 1, win 2048, options [nop,nop,TS val 1330161552 ecr 1488063449], length 1368
22:50:18.785109 IP 10.34.1.208.53645 > 172.217.9.138.443: Flags [.], seq 6840:8208, ack 1, win 2048, options [nop,nop,TS val 1330161552 ecr 1488063449], length 1368
22:50:18.785110 IP 10.34.1.208.53645 > 172.217.9.138.443: Flags [P.], seq 8208:8229, ack 1, win 2048, options [nop,nop,TS val 1330161552 ecr 1488063449], length 21
22:50:18.785304 IP 10.34.1.208.53645 > 172.217.9.138.443: Flags [.], seq 8229:9597, ack 1, win 2048, options [nop,nop,TS val 1330161552 ecr 1488063449], length 1368
22:50:18.785306 IP 10.34.1.208.53645 > 172.217.9.138.443: Flags [.], seq 9597:10965, ack 1, win 2048, options [nop,nop,TS val 1330161552 ecr 1488063449], length 1368
22:50:18.785307 IP 10.34.1.208.53645 > 172.217.9.138.443: Flags [.], seq 10965:12333, ack 1, win 2048, options [nop,nop,TS val 1330161552 ecr 1488063449], length 1368
22:50:18.785308 IP 10.34.1.208.53645 > 172.217.9.138.443: Flags [.], seq 12333:13701, ack 1, win 2048, options [nop,nop,TS val 1330161552 ecr 1488063449], length 1368
22:50:18.785309 IP 10.34.1.208.53645 > 172.217.9.138.443: Flags [.], seq 13701:15069, ack 1, win 2048, options [nop,nop,TS val 1330161552 ecr 1488063449], length 1368
22:50:18.785310 IP 10.34.1.208.53645 > 172.217.9.138.443: Flags [.], seq 15069:16437, ack 1, win 2048, options [nop,nop,TS val 1330161552 ecr 1488063449], length 1368
22:50:18.785311 IP 10.34.1.208.53645 > 172.217.9.138.443: Flags [P.], seq 16437:16458, ack 1, win 2048, options [nop,nop,TS val 1330161552 ecr 1488063449], length 21
22:50:18.814885 IP 10.34.1.208.53645 > 172.217.9.138.443: Flags [.], seq 16458:17826, ack 1, win 2048, options [nop,nop,TS val 1330161580 ecr 1488063469], length 1368
22:50:18.814890 IP 10.34.1.208.53645 > 172.217.9.138.443: Flags [.], seq 17826:19194, ack 1, win 2048, options [nop,nop,TS val 1330161580 ecr 1488063469], length 1368
22:50:18.814891 IP 10.34.1.208.53645 > 172.217.9.138.443: Flags [.], seq 19194:20562, ack 1, win 2048, options [nop,nop,TS val 1330161580 ecr 1488063469], length 1368
22:50:18.814892 IP 10.34.1.208.53645 > 172.217.9.138.443: Flags [.], seq 20562:21930, ack 1, win 2048, options [nop,nop,TS val 1330161580 ecr 1488063469], length 1368
22:50:18.814893 IP 10.34.1.208.53645 > 172.217.9.138.443: Flags [.], seq 21930:23298, ack 1, win 2048, options [nop,nop,TS val 1330161580 ecr 1488063469], length 1368
22:50:18.814895 IP 10.34.1.208.53645 > 172.217.9.138.443: Flags [.], seq 23298:24666, ack 1, win 2048, options [nop,nop,TS val 1330161580 ecr 1488063469], length 1368
22:50:18.814896 IP 10.34.1.208.53645 > 172.217.9.138.443: Flags [P.], seq 24666:24687, ack 1, win 2048, options [nop,nop,TS val 1330161580 ecr 1488063469], length 21
22:50:18.840599 IP 10.34.1.208.53645 > 172.217.9.138.443: Flags [.], seq 24687:26055, ack 1, win 2048, options [nop,nop,TS val 1330161604 ecr 1488063497], length 1368
22:50:18.840604 IP 10.34.1.208.53645 > 172.217.9.138.443: Flags [.], seq 26055:27423, ack 1, win 2048, options [nop,nop,TS val 1330161604 ecr 1488063497], length 1368
22:50:18.840606 IP 10.34.1.208.53645 > 172.217.9.138.443: Flags [.], seq 27423:28791, ack 1, win 2048, options [nop,nop,TS val 1330161604 ecr 1488063497], length 1368
22:50:18.840607 IP 10.34.1.208.53645 > 172.217.9.138.443: Flags [.], seq 28791:30159, ack 1, win 2048, options [nop,nop,TS val 1330161604 ecr 1488063497], length 1368
22:50:18.840609 IP 10.34.1.208.53645 > 172.217.9.138.443: Flags [.], seq 30159:31527, ack 1, win 2048, options [nop,nop,TS val 1330161604 ecr 1488063497], length 1368
22:50:18.840610 IP 10.34.1.208.53645 > 172.217.9.138.443: Flags [.], seq 31527:32895, ack 1, win 2048, options [nop,nop,TS val 1330161604 ecr 1488063497], length 1368
22:50:18.840611 IP 10.34.1.208.53645 > 172.217.9.138.443: Flags [P.], seq 32895:32916, ack 1, win 2048, options [nop,nop,TS val 1330161604 ecr 1488063497], length 21
22:50:18.855817 IP 10.34.1.208.53645 > 172.217.9.138.443: Flags [.], seq 32916:34284, ack 1, win 2048, options [nop,nop,TS val 1330161618 ecr 1488063523], length 1368
22:50:18.855821 IP 10.34.1.208.53645 > 172.217.9.138.443: Flags [.], seq 34284:35652, ack 1, win 2048, options [nop,nop,TS val 1330161618 ecr 1488063523], length 1368
22:50:18.855822 IP 10.34.1.208.53645 > 172.217.9.138.443: Flags [.], seq 35652:37020, ack 1, win 2048, options [nop,nop,TS val 1330161618 ecr 1488063523], length 1368
22:50:18.855823 IP 10.34.1.208.53645 > 172.217.9.138.443: Flags [.], seq 37020:38388, ack 1, win 2048, options [nop,nop,TS val 1330161618 ecr 1488063523], length 1368
22:50:18.855824 IP 10.34.1.208.53645 > 172.217.9.138.443: Flags [.], seq 38388:39756, ack 1, win 2048, options [nop,nop,TS val 1330161618 ecr 1488063523], length 1368
22:50:18.855826 IP 10.34.1.208.53645 > 172.217.9.138.443: Flags [.], seq 39756:41124, ack 1, win 2048, options [nop,nop,TS val 1330161618 ecr 1488063523], length 1368
22:50:18.855827 IP 10.34.1.208.53645 > 172.217.9.138.443: Flags [P.], seq 41124:41145, ack 1, win 2048, options [nop,nop,TS val 1330161618 ecr 1488063523], length 21
22:50:18.857920 IP 10.34.1.208.53645 > 172.217.9.138.443: Flags [.], seq 41145:42513, ack 1, win 2048, options [nop,nop,TS val 1330161620 ecr 1488063523], length 1368
22:50:18.857924 IP 10.34.1.208.53645 > 172.217.9.138.443: Flags [.], seq 42513:43881, ack 1, win 2048, options [nop,nop,TS val 1330161620 ecr 1488063523], length 1368
22:50:18.857925 IP 10.34.1.208.53645 > 172.217.9.138.443: Flags [.], seq 43881:45249, ack 1, win 2048, options [nop,nop,TS val 1330161620 ecr 1488063523], length 1368
22:50:18.857927 IP 10.34.1.208.53645 > 172.217.9.138.443: Flags [.], seq 45249:46617, ack 1, win 2048, options [nop,nop,TS val 1330161620 ecr 1488063523], length 1368
22:50:18.857928 IP 10.34.1.208.53645 > 172.217.9.138.443: Flags [.], seq 46617:47985, ack 1, win 2048, options [nop,nop,TS val 1330161620 ecr 1488063523], length 1368
22:50:18.857929 IP 10.34.1.208.53645 > 172.217.9.138.443: Flags [.], seq 47985:49353, ack 1, win 2048, options [nop,nop,TS val 1330161620 ecr 1488063523], length 1368
22:50:18.857930 IP 10.34.1.208.53645 > 172.217.9.138.443: Flags [P.], seq 49353:49374, ack 1, win 2048, options [nop,nop,TS val 1330161620 ecr 1488063523], length 21
22:50:18.875234 IP 10.34.1.208.52665 > 216.58.194.138.443: Flags [.], seq 2435550946:2435552314, ack 3836058678, win 2048, options [nop,nop,TS val 1330161635 ecr 3671763297], length 1368
22:50:18.875239 IP 10.34.1.208.52665 > 216.58.194.138.443: Flags [P.], seq 1368:1627, ack 1, win 2048, options [nop,nop,TS val 1330161635 ecr 3671763297], length 259
22:50:18.930439 IP 10.34.1.208.53645 > 172.217.9.138.443: Flags [.], seq 49374:50742, ack 1, win 2048, options [nop,nop,TS val 1330161689 ecr 1488063541], length 1368
22:50:18.930444 IP 10.34.1.208.53645 > 172.217.9.138.443: Flags [.], seq 50742:52110, ack 1, win 2048, options [nop,nop,TS val 1330161689 ecr 1488063541], length 1368
22:50:18.930445 IP 10.34.1.208.53645 > 172.217.9.138.443: Flags [.], seq 52110:53478, ack 1, win 2048, options [nop,nop,TS val 1330161689 ecr 1488063541], length 1368
22:50:18.930446 IP 10.34.1.208.53645 > 172.217.9.138.443: Flags [.], seq 53478:54846, ack 1, win 2048, options [nop,nop,TS val 1330161689 ecr 1488063541], length 1368
22:50:18.930447 IP 10.34.1.208.53645 > 172.217.9.138.443: Flags [.], seq 54846:56214, ack 1, win 2048, options [nop,nop,TS val 1330161689 ecr 1488063541], length 1368
22:50:18.930448 IP 10.34.1.208.53645 > 172.217.9.138.443: Flags [.], seq 56214:57582, ack 1, win 2048, options [nop,nop,TS val 1330161689 ecr 1488063541], length 1368
22:50:18.930449 IP 10.34.1.208.53645 > 172.217.9.138.443: Flags [P.], seq 57582:57603, ack 1, win 2048, options [nop,nop,TS val 1330161689 ecr 1488063541], length 21
22:50:18.930622 IP 10.34.1.208.53645 > 172.217.9.138.443: Flags [.], seq 57603:58971, ack 1, win 2048, options [nop,nop,TS val 1330161689 ecr 1488063541], length 1368
22:50:18.930625 IP 10.34.1.208.53645 > 172.217.9.138.443: Flags [.], seq 58971:60339, ack 1, win 2048, options [nop,nop,TS val 1330161689 ecr 1488063541], length 1368
22:50:18.930626 IP 10.34.1.208.53645 > 172.217.9.138.443: Flags [.], seq 60339:61707, ack 1, win 2048, options [nop,nop,TS val 1330161689 ecr 1488063541], length 1368
22:50:18.930627 IP 10.34.1.208.53645 > 172.217.9.138.443: Flags [.], seq 61707:63075, ack 1, win 2048, options [nop,nop,TS val 1330161689 ecr 1488063541], length 1368
22:50:18.930628 IP 10.34.1.208.53645 > 172.217.9.138.443: Flags [.], seq 63075:64443, ack 1, win 2048, options [nop,nop,TS val 1330161689 ecr 1488063541], length 1368
22:50:18.930629 IP 10.34.1.208.53645 > 172.217.9.138.443: Flags [.], seq 64443:65811, ack 1, win 2048, options [nop,nop,TS val 1330161689 ecr 1488063541], length 1368
22:50:18.930630 IP 10.34.1.208.53645 > 172.217.9.138.443: Flags [P.], seq 65811:65832, ack 1, win 2048, options [nop,nop,TS val 1330161689 ecr 1488063541], length 21
22:50:18.977487 IP 10.34.1.208.53645 > 172.217.9.138.443: Flags [.], seq 65832:67200, ack 1, win 2048, options [nop,nop,TS val 1330161734 ecr 1488063614], length 1368
22:50:18.977492 IP 10.34.1.208.53645 > 172.217.9.138.443: Flags [.], seq 67200:68568, ack 1, win 2048, options [nop,nop,TS val 1330161734 ecr 1488063614], length 1368
22:50:18.977493 IP 10.34.1.208.53645 > 172.217.9.138.443: Flags [.], seq 68568:69936, ack 1, win 2048, options [nop,nop,TS val 1330161734 ecr 1488063614], length 1368
22:50:18.977495 IP 10.34.1.208.53645 > 172.217.9.138.443: Flags [.], seq 69936:71304, ack 1, win 2048, options [nop,nop,TS val 1330161734 ecr 1488063614], length 1368
22:50:18.977496 IP 10.34.1.208.53645 > 172.217.9.138.443: Flags [.], seq 71304:72672, ack 1, win 2048, options [nop,nop,TS val 1330161734 ecr 1488063614], length 1368
22:50:18.977498 IP 10.34.1.208.53645 > 172.217.9.138.443: Flags [.], seq 72672:74040, ack 1, win 2048, options [nop,nop,TS val 1330161734 ecr 1488063614], length 1368
22:50:18.977499 IP 10.34.1.208.53645 > 172.217.9.138.443: Flags [P.], seq 74040:74061, ack 1, win 2048, options [nop,nop,TS val 1330161734 ecr 1488063614], length 21
22:50:18.981537 IP 10.34.1.208.53645 > 172.217.9.138.443: Flags [.], seq 74061:75429, ack 1, win 2048, options [nop,nop,TS val 1330161737 ecr 1488063660], length 1368
22:50:18.981541 IP 10.34.1.208.53645 > 172.217.9.138.443: Flags [.], seq 75429:76797, ack 1, win 2048, options [nop,nop,TS val 1330161737 ecr 1488063660], length 1368
22:50:18.981542 IP 10.34.1.208.53645 > 172.217.9.138.443: Flags [.], seq 76797:78165, ack 1, win 2048, options [nop,nop,TS val 1330161737 ecr 1488063660], length 1368
22:50:18.981543 IP 10.34.1.208.53645 > 172.217.9.138.443: Flags [.], seq 78165:79533, ack 1, win 2048, options [nop,nop,TS val 1330161737 ecr 1488063660], length 1368
22:50:18.981544 IP 10.34.1.208.53645 > 172.217.9.138.443: Flags [.], seq 79533:80901, ack 1, win 2048, options [nop,nop,TS val 1330161737 ecr 1488063660], length 1368
22:50:18.981545 IP 10.34.1.208.53645 > 172.217.9.138.443: Flags [.], seq 80901:82269, ack 1, win 2048, options [nop,nop,TS val 1330161737 ecr 1488063660], length 1368
22:50:18.981546 IP 10.34.1.208.53645 > 172.217.9.138.443: Flags [P.], seq 82269:82290, ack 1, win 2048, options [nop,nop,TS val 1330161737 ecr 1488063660], length 21
22:50:19.028252 IP 10.34.1.208.53645 > 172.217.9.138.443: Flags [.], seq 82290:83658, ack 1, win 2048, options [nop,nop,TS val 1330161782 ecr 1488063664], length 1368
22:50:19.028257 IP 10.34.1.208.53645 > 172.217.9.138.443: Flags [.], seq 83658:85026, ack 1, win 2048, options [nop,nop,TS val 1330161782 ecr 1488063664], length 1368
22:50:19.028258 IP 10.34.1.208.53645 > 172.217.9.138.443: Flags [.], seq 85026:86394, ack 1, win 2048, options [nop,nop,TS val 1330161782 ecr 1488063664], length 1368
22:50:19.028259 IP 10.34.1.208.53645 > 172.217.9.138.443: Flags [.], seq 86394:87762, ack 1, win 2048, options [nop,nop,TS val 1330161782 ecr 1488063664], length 1368
22:50:19.028260 IP 10.34.1.208.53645 > 172.217.9.138.443: Flags [.], seq 87762:89130, ack 1, win 2048, options [nop,nop,TS val 1330161782 ecr 1488063664], length 1368
22:50:19.028261 IP 10.34.1.208.53645 > 172.217.9.138.443: Flags [.], seq 89130:90498, ack 1, win 2048, options [nop,nop,TS val 1330161782 ecr 1488063664], length 1368
22:50:19.028262 IP 10.34.1.208.53645 > 172.217.9.138.443: Flags [P.], seq 90498:90519, ack 1, win 2048, options [nop,nop,TS val 1330161782 ecr 1488063664], length 21
22:50:19.037263 IP 10.34.1.208.53645 > 172.217.9.138.443: Flags [.], seq 90519:91887, ack 1, win 2048, options [nop,nop,TS val 1330161791 ecr 1488063664], length 1368
22:50:19.037269 IP 10.34.1.208.53645 > 172.217.9.138.443: Flags [.], seq 91887:93255, ack 1, win 2048, options [nop,nop,TS val 1330161791 ecr 1488063664], length 1368
22:50:19.037271 IP 10.34.1.208.53645 > 172.217.9.138.443: Flags [.], seq 93255:94623, ack 1, win 2048, options [nop,nop,TS val 1330161791 ecr 1488063664], length 1368
22:50:19.037272 IP 10.34.1.208.53645 > 172.217.9.138.443: Flags [.], seq 94623:95991, ack 1, win 2048, options [nop,nop,TS val 1330161791 ecr 1488063664], length 1368
22:50:19.037274 IP 10.34.1.208.53645 > 172.217.9.138.443: Flags [.], seq 95991:97359, ack 1, win 2048, options [nop,nop,TS val 1330161791 ecr 1488063664], length 1368
22:50:19.037275 IP 10.34.1.208.53645 > 172.217.9.138.443: Flags [.], seq 97359:98727, ack 1, win 2048, options [nop,nop,TS val 1330161791 ecr 1488063664], length 1368
22:50:19.037276 IP 10.34.1.208.53645 > 172.217.9.138.443: Flags [P.], seq 98727:98748, ack 1, win 2048, options [nop,nop,TS val 1330161791 ecr 1488063664], length 21
22:50:19.060734 IP 10.34.1.208.53645 > 172.217.9.138.443: Flags [.], seq 98748:100116, ack 1, win 2048, options [nop,nop,TS val 1330161814 ecr 1488063723], length 1368
22:50:19.060738 IP 10.34.1.208.53645 > 172.217.9.138.443: Flags [.], seq 100116:101484, ack 1, win 2048, options [nop,nop,TS val 1330161814 ecr 1488063723], length 1368
22:50:19.060739 IP 10.34.1.208.53645 > 172.217.9.138.443: Flags [.], seq 101484:102852, ack 1, win 2048, options [nop,nop,TS val 1330161814 ecr 1488063723], length 1368
22:50:19.060740 IP 10.34.1.208.53645 > 172.217.9.138.443: Flags [.], seq 102852:104220, ack 1, win 2048, options [nop,nop,TS val 1330161814 ecr 1488063723], length 1368
22:50:19.060741 IP 10.34.1.208.53645 > 172.217.9.138.443: Flags [.], seq 104220:105588, ack 1, win 2048, options [nop,nop,TS val 1330161814 ecr 1488063723], length 1368
22:50:19.060742 IP 10.34.1.208.53645 > 172.217.9.138.443: Flags [.], seq 105588:106956, ack 1, win 2048, options [nop,nop,TS val 1330161814 ecr 1488063723], length 1368
22:50:19.060743 IP 10.34.1.208.53645 > 172.217.9.138.443: Flags [P.], seq 106956:106977, ack 1, win 2048, options [nop,nop,TS val 1330161814 ecr 1488063723], length 21
22:50:19.064002 IP 10.34.1.208.53645 > 172.217.9.138.443: Flags [.], seq 106977:108345, ack 1, win 2048, options [nop,nop,TS val 1330161817 ecr 1488063723], length 1368
22:50:19.064008 IP 10.34.1.208.53645 > 172.217.9.138.443: Flags [.], seq 108345:109713, ack 1, win 2048, options [nop,nop,TS val 1330161817 ecr 1488063723], length 1368
22:50:19.064010 IP 10.34.1.208.53645 > 172.217.9.138.443: Flags [.], seq 109713:111081, ack 1, win 2048, options [nop,nop,TS val 1330161817 ecr 1488063723], length 1368
22:50:19.064011 IP 10.34.1.208.53645 > 172.217.9.138.443: Flags [.], seq 111081:112449, ack 1, win 2048, options [nop,nop,TS val 1330161817 ecr 1488063723], length 1368
22:50:19.064013 IP 10.34.1.208.53645 > 172.217.9.138.443: Flags [.], seq 112449:113817, ack 1, win 2048, options [nop,nop,TS val 1330161817 ecr 1488063723], length 1368
22:50:19.064014 IP 10.34.1.208.53645 > 172.217.9.138.443: Flags [.], seq 113817:115185, ack 1, win 2048, options [nop,nop,TS val 1330161817 ecr 1488063723], length 1368
22:50:19.064015 IP 10.34.1.208.53645 > 172.217.9.138.443: Flags [P.], seq 115185:115206, ack 1, win 2048, options [nop,nop,TS val 1330161817 ecr 1488063723], length 21
22:50:19.088296 IP 10.34.1.208.53645 > 172.217.9.138.443: Flags [.], seq 115206:116574, ack 1, win 2048, options [nop,nop,TS val 1330161840 ecr 1488063747], length 1368
22:50:19.088302 IP 10.34.1.208.53645 > 172.217.9.138.443: Flags [.], seq 116574:117942, ack 1, win 2048, options [nop,nop,TS val 1330161840 ecr 1488063747], length 1368
22:50:19.088304 IP 10.34.1.208.53645 > 172.217.9.138.443: Flags [.], seq 117942:119310, ack 1, win 2048, options [nop,nop,TS val 1330161840 ecr 1488063747], length 1368
22:50:19.088305 IP 10.34.1.208.53645 > 172.217.9.138.443: Flags [.], seq 119310:120678, ack 1, win 2048, options [nop,nop,TS val 1330161840 ecr 1488063747], length 1368
22:50:19.088383 IP 10.34.1.208.53645 > 172.217.9.138.443: Flags [.], seq 120678:122046, ack 1, win 2048, options [nop,nop,TS val 1330161840 ecr 1488063747], length 1368
22:50:19.088384 IP 10.34.1.208.53645 > 172.217.9.138.443: Flags [.], seq 122046:123414, ack 1, win 2048, options [nop,nop,TS val 1330161840 ecr 1488063747], length 1368
22:50:19.088385 IP 10.34.1.208.53645 > 172.217.9.138.443: Flags [P.], seq 123414:123435, ack 1, win 2048, options [nop,nop,TS val 1330161840 ecr 1488063747], length 21
22:50:19.090526 IP 10.34.1.208.53645 > 172.217.9.138.443: Flags [.], seq 123435:124803, ack 1, win 2048, options [nop,nop,TS val 1330161842 ecr 1488063747], length 1368
22:50:19.090533 IP 10.34.1.208.53645 > 172.217.9.138.443: Flags [.], seq 124803:126171, ack 1, win 2048, options [nop,nop,TS val 1330161842 ecr 1488063747], length 1368
22:50:19.090535 IP 10.34.1.208.53645 > 172.217.9.138.443: Flags [.], seq 126171:127539, ack 1, win 2048, options [nop,nop,TS val 1330161842 ecr 1488063747], length 1368
22:50:19.090537 IP 10.34.1.208.53645 > 172.217.9.138.443: Flags [.], seq 127539:128907, ack 1, win 2048, options [nop,nop,TS val 1330161842 ecr 1488063747], length 1368
22:50:19.090538 IP 10.34.1.208.53645 > 172.217.9.138.443: Flags [.], seq 128907:130275, ack 1, win 2048, options [nop,nop,TS val 1330161842 ecr 1488063747], length 1368
22:50:19.090539 IP 10.34.1.208.53645 > 172.217.9.138.443: Flags [.], seq 130275:131643, ack 1, win 2048, options [nop,nop,TS val 1330161842 ecr 1488063747], length 1368
22:50:19.090540 IP 10.34.1.208.53645 > 172.217.9.138.443: Flags [P.], seq 131643:131664, ack 1, win 2048, options [nop,nop,TS val 1330161842 ecr 1488063747], length 21
22:50:19.099745 IP 10.34.1.208.53645 > 172.217.9.138.443: Flags [.], seq 131664:133032, ack 1, win 2048, options [nop,nop,TS val 1330161850 ecr 1488063773], length 1368
22:50:19.099749 IP 10.34.1.208.53645 > 172.217.9.138.443: Flags [.], seq 133032:134400, ack 1, win 2048, options [nop,nop,TS val 1330161850 ecr 1488063773], length 1368
22:50:19.099750 IP 10.34.1.208.53645 > 172.217.9.138.443: Flags [.], seq 134400:135768, ack 1, win 2048, options [nop,nop,TS val 1330161850 ecr 1488063773], length 1368
22:50:19.099751 IP 10.34.1.208.53645 > 172.217.9.138.443: Flags [.], seq 135768:137136, ack 1, win 2048, options [nop,nop,TS val 1330161850 ecr 1488063773], length 1368
22:50:19.099751 IP 10.34.1.208.53645 > 172.217.9.138.443: Flags [.], seq 137136:138504, ack 1, win 2048, options [nop,nop,TS val 1330161850 ecr 1488063773], length 1368
22:50:19.099752 IP 10.34.1.208.53645 > 172.217.9.138.443: Flags [.], seq 138504:139872, ack 1, win 2048, options [nop,nop,TS val 1330161850 ecr 1488063773], length 1368
22:50:19.099753 IP 10.34.1.208.53645 > 172.217.9.138.443: Flags [P.], seq 139872:139893, ack 1, win 2048, options [nop,nop,TS val 1330161850 ecr 1488063773], length 21
22:50:19.120663 IP 10.34.1.208.53645 > 172.217.9.138.443: Flags [.], seq 139893:141261, ack 1, win 2048, options [nop,nop,TS val 1330161870 ecr 1488063782], length 1368
22:50:19.120668 IP 10.34.1.208.53645 > 172.217.9.138.443: Flags [.], seq 141261:142629, ack 1, win 2048, options [nop,nop,TS val 1330161870 ecr 1488063782], length 1368
22:50:19.120669 IP 10.34.1.208.53645 > 172.217.9.138.443: Flags [.], seq 142629:143997, ack 1, win 2048, options [nop,nop,TS val 1330161870 ecr 1488063782], length 1368
22:50:19.120670 IP 10.34.1.208.53645 > 172.217.9.138.443: Flags [.], seq 143997:145365, ack 1, win 2048, options [nop,nop,TS val 1330161870 ecr 1488063782], length 1368
22:50:19.120672 IP 10.34.1.208.53645 > 172.217.9.138.443: Flags [.], seq 145365:146733, ack 1, win 2048, options [nop,nop,TS val 1330161870 ecr 1488063782], length 1368
22:50:19.120673 IP 10.34.1.208.53645 > 172.217.9.138.443: Flags [.], seq 146733:148101, ack 1, win 2048, options [nop,nop,TS val 1330161870 ecr 1488063782], length 1368
22:50:19.120673 IP 10.34.1.208.53645 > 172.217.9.138.443: Flags [P.], seq 148101:148122, ack 1, win 2048, options [nop,nop,TS val 1330161870 ecr 1488063782], length 21
22:50:19.136674 IP 10.34.1.208.53645 > 172.217.9.138.443: Flags [.], seq 148122:149490, ack 1, win 2048, options [nop,nop,TS val 1330161885 ecr 1488063803], length 1368
22:50:19.136680 IP 10.34.1.208.53645 > 172.217.9.138.443: Flags [.], seq 149490:150858, ack 1, win 2048, options [nop,nop,TS val 1330161885 ecr 1488063803], length 1368
22:50:19.136681 IP 10.34.1.208.53645 > 172.217.9.138.443: Flags [.], seq 150858:152226, ack 1, win 2048, options [nop,nop,TS val 1330161885 ecr 1488063803], length 1368
22:50:19.136683 IP 10.34.1.208.53645 > 172.217.9.138.443: Flags [.], seq 152226:153594, ack 1, win 2048, options [nop,nop,TS val 1330161885 ecr 1488063803], length 1368
22:50:19.136684 IP 10.34.1.208.53645 > 172.217.9.138.443: Flags [.], seq 153594:154962, ack 1, win 2048, options [nop,nop,TS val 1330161885 ecr 1488063803], length 1368
22:50:19.136685 IP 10.34.1.208.53645 > 172.217.9.138.443: Flags [.], seq 154962:156330, ack 1, win 2048, options [nop,nop,TS val 1330161885 ecr 1488063803], length 1368
22:50:19.136686 IP 10.34.1.208.53645 > 172.217.9.138.443: Flags [P.], seq 156330:156351, ack 1, win 2048, options [nop,nop,TS val 1330161885 ecr 1488063803], length 21
22:50:19.139990 IP 10.34.1.208.53645 > 172.217.9.138.443: Flags [.], seq 156351:157719, ack 1, win 2048, options [nop,nop,TS val 1330161888 ecr 1488063803], length 1368
22:50:19.139995 IP 10.34.1.208.53645 > 172.217.9.138.443: Flags [.], seq 157719:159087, ack 1, win 2048, options [nop,nop,TS val 1330161888 ecr 1488063803], length 1368
22:50:19.139997 IP 10.34.1.208.53645 > 172.217.9.138.443: Flags [.], seq 159087:160455, ack 1, win 2048, options [nop,nop,TS val 1330161888 ecr 1488063803], length 1368
22:50:19.139998 IP 10.34.1.208.53645 > 172.217.9.138.443: Flags [.], seq 160455:161823, ack 1, win 2048, options [nop,nop,TS val 1330161888 ecr 1488063803], length 1368
22:50:19.140000 IP 10.34.1.208.53645 > 172.217.9.138.443: Flags [.], seq 161823:163191, ack 1, win 2048, options [nop,nop,TS val 1330161888 ecr 1488063803], length 1368
22:50:19.140001 IP 10.34.1.208.53645 > 172.217.9.138.443: Flags [.], seq 163191:164559, ack 1, win 2048, options [nop,nop,TS val 1330161888 ecr 1488063803], length 1368
22:50:19.140002 IP 10.34.1.208.53645 > 172.217.9.138.443: Flags [P.], seq 164559:164580, ack 1, win 2048, options [nop,nop,TS val 1330161888 ecr 1488063803], length 21
22:50:19.176640 IP 10.34.1.208.53645 > 172.217.9.138.443: Flags [.], seq 164580:165948, ack 1, win 2048, options [nop,nop,TS val 1330161922 ecr 1488063829], length 1368
22:50:19.176645 IP 10.34.1.208.53645 > 172.217.9.138.443: Flags [.], seq 165948:167316, ack 1, win 2048, options [nop,nop,TS val 1330161922 ecr 1488063829], length 1368
22:50:19.176647 IP 10.34.1.208.53645 > 172.217.9.138.443: Flags [.], seq 167316:168684, ack 1, win 2048, options [nop,nop,TS val 1330161922 ecr 1488063829], length 1368
22:50:19.176648 IP 10.34.1.208.53645 > 172.217.9.138.443: Flags [.], seq 168684:170052, ack 1, win 2048, options [nop,nop,TS val 1330161922 ecr 1488063829], length 1368
22:50:19.176649 IP 10.34.1.208.53645 > 172.217.9.138.443: Flags [.], seq 170052:171420, ack 1, win 2048, options [nop,nop,TS val 1330161922 ecr 1488063829], length 1368
22:50:19.176651 IP 10.34.1.208.53645 > 172.217.9.138.443: Flags [.], seq 171420:172788, ack 1, win 2048, options [nop,nop,TS val 1330161922 ecr 1488063829], length 1368
22:50:19.176652 IP 10.34.1.208.53645 > 172.217.9.138.443: Flags [P.], seq 172788:172809, ack 1, win 2048, options [nop,nop,TS val 1330161922 ecr 1488063829], length 21
22:50:19.177243 IP 10.34.1.208.53645 > 172.217.9.138.443: Flags [.], seq 172809:174177, ack 1, win 2048, options [nop,nop,TS val 1330161922 ecr 1488063829], length 1368
22:50:19.177249 IP 10.34.1.208.53645 > 172.217.9.138.443: Flags [.], seq 174177:175545, ack 1, win 2048, options [nop,nop,TS val 1330161922 ecr 1488063829], length 1368
22:50:19.177250 IP 10.34.1.208.53645 > 172.217.9.138.443: Flags [.], seq 175545:176913, ack 1, win 2048, options [nop,nop,TS val 1330161922 ecr 1488063829], length 1368
22:50:19.177251 IP 10.34.1.208.53645 > 172.217.9.138.443: Flags [.], seq 176913:178281, ack 1, win 2048, options [nop,nop,TS val 1330161922 ecr 1488063829], length 1368
22:50:19.177252 IP 10.34.1.208.53645 > 172.217.9.138.443: Flags [.], seq 178281:179649, ack 1, win 2048, options [nop,nop,TS val 1330161922 ecr 1488063829], length 1368
22:50:19.177253 IP 10.34.1.208.53645 > 172.217.9.138.443: Flags [.], seq 179649:181017, ack 1, win 2048, options [nop,nop,TS val 1330161922 ecr 1488063829], length 1368
22:50:19.177255 IP 10.34.1.208.53645 > 172.217.9.138.443: Flags [P.], seq 181017:181038, ack 1, win 2048, options [nop,nop,TS val 1330161922 ecr 1488063829], length 21
22:50:19.190126 IP 10.34.1.208.53645 > 172.217.9.138.443: Flags [.], seq 181038:182406, ack 1, win 2048, options [nop,nop,TS val 1330161935 ecr 1488063860], length 1368
22:50:19.190133 IP 10.34.1.208.53645 > 172.217.9.138.443: Flags [.], seq 182406:183774, ack 1, win 2048, options [nop,nop,TS val 1330161935 ecr 1488063860], length 1368
22:50:19.190134 IP 10.34.1.208.53645 > 172.217.9.138.443: Flags [.], seq 183774:185142, ack 1, win 2048, options [nop,nop,TS val 1330161935 ecr 1488063860], length 1368
22:50:19.190135 IP 10.34.1.208.53645 > 172.217.9.138.443: Flags [.], seq 185142:186510, ack 1, win 2048, options [nop,nop,TS val 1330161935 ecr 1488063860], length 1368
22:50:19.190136 IP 10.34.1.208.53645 > 172.217.9.138.443: Flags [.], seq 186510:187878, ack 1, win 2048, options [nop,nop,TS val 1330161935 ecr 1488063860], length 1368
22:50:19.190137 IP 10.34.1.208.53645 > 172.217.9.138.443: Flags [.], seq 187878:189246, ack 1, win 2048, options [nop,nop,TS val 1330161935 ecr 1488063860], length 1368
22:50:19.190138 IP 10.34.1.208.53645 > 172.217.9.138.443: Flags [P.], seq 189246:189267, ack 1, win 2048, options [nop,nop,TS val 1330161935 ecr 1488063860], length 21
22:50:19.193142 IP 10.34.1.208.53645 > 172.217.9.138.443: Flags [.], seq 189267:190635, ack 1, win 2048, options [nop,nop,TS val 1330161938 ecr 1488063860], length 1368
22:50:19.193148 IP 10.34.1.208.53645 > 172.217.9.138.443: Flags [.], seq 190635:192003, ack 1, win 2048, options [nop,nop,TS val 1330161938 ecr 1488063860], length 1368
22:50:19.193149 IP 10.34.1.208.53645 > 172.217.9.138.443: Flags [.], seq 192003:193371, ack 1, win 2048, options [nop,nop,TS val 1330161938 ecr 1488063860], length 1368
22:50:19.193150 IP 10.34.1.208.53645 > 172.217.9.138.443: Flags [.], seq 193371:194739, ack 1, win 2048, options [nop,nop,TS val 1330161938 ecr 1488063860], length 1368
22:50:19.193152 IP 10.34.1.208.53645 > 172.217.9.138.443: Flags [.], seq 194739:196107, ack 1, win 2048, options [nop,nop,TS val 1330161938 ecr 1488063860], length 1368
22:50:19.193153 IP 10.34.1.208.53645 > 172.217.9.138.443: Flags [.], seq 196107:197475, ack 1, win 2048, options [nop,nop,TS val 1330161938 ecr 1488063860], length 1368
22:50:19.193154 IP 10.34.1.208.53645 > 172.217.9.138.443: Flags [P.], seq 197475:197496, ack 1, win 2048, options [nop,nop,TS val 1330161938 ecr 1488063860], length 21
22:50:19.208352 IP 10.34.1.208.53645 > 172.217.9.138.443: Flags [.], seq 197496:198864, ack 1, win 2048, options [nop,nop,TS val 1330161952 ecr 1488063876], length 1368
22:50:19.208356 IP 10.34.1.208.53645 > 172.217.9.138.443: Flags [.], seq 198864:200232, ack 1, win 2048, options [nop,nop,TS val 1330161952 ecr 1488063876], length 1368
22:50:19.208357 IP 10.34.1.208.53645 > 172.217.9.138.443: Flags [.], seq 200232:201600, ack 1, win 2048, options [nop,nop,TS val 1330161952 ecr 1488063876], length 1368
22:50:19.208358 IP 10.34.1.208.53645 > 172.217.9.138.443: Flags [.], seq 201600:202968, ack 1, win 2048, options [nop,nop,TS val 1330161952 ecr 1488063876], length 1368
22:50:19.208359 IP 10.34.1.208.53645 > 172.217.9.138.443: Flags [.], seq 202968:204336, ack 1, win 2048, options [nop,nop,TS val 1330161952 ecr 1488063876], length 1368
22:50:19.208360 IP 10.34.1.208.53645 > 172.217.9.138.443: Flags [.], seq 204336:205704, ack 1, win 2048, options [nop,nop,TS val 1330161952 ecr 1488063876], length 1368
22:50:19.208361 IP 10.34.1.208.53645 > 172.217.9.138.443: Flags [P.], seq 205704:205725, ack 1, win 2048, options [nop,nop,TS val 1330161952 ecr 1488063876], length 21
22:50:19.209499 IP 10.34.1.208.53645 > 172.217.9.138.443: Flags [.], seq 205725:207093, ack 1, win 2048, options [nop,nop,TS val 1330161953 ecr 1488063876], length 1368
22:50:19.209503 IP 10.34.1.208.53645 > 172.217.9.138.443: Flags [.], seq 207093:208461, ack 1, win 2048, options [nop,nop,TS val 1330161953 ecr 1488063876], length 1368
22:50:19.209505 IP 10.34.1.208.53645 > 172.217.9.138.443: Flags [.], seq 208461:209829, ack 1, win 2048, options [nop,nop,TS val 1330161953 ecr 1488063876], length 1368
22:50:19.209506 IP 10.34.1.208.53645 > 172.217.9.138.443: Flags [.], seq 209829:211197, ack 1, win 2048, options [nop,nop,TS val 1330161953 ecr 1488063876], length 1368
22:50:19.209507 IP 10.34.1.208.53645 > 172.217.9.138.443: Flags [.], seq 211197:212565, ack 1, win 2048, options [nop,nop,TS val 1330161953 ecr 1488063876], length 1368
22:50:19.209508 IP 10.34.1.208.53645 > 172.217.9.138.443: Flags [.], seq 212565:213933, ack 1, win 2048, options [nop,nop,TS val 1330161953 ecr 1488063876], length 1368
22:50:19.209509 IP 10.34.1.208.53645 > 172.217.9.138.443: Flags [P.], seq 213933:213954, ack 1, win 2048, options [nop,nop,TS val 1330161953 ecr 1488063876], length 21
22:50:19.212940 IP 10.34.1.208.53645 > 172.217.9.138.443: Flags [.], seq 213954:215322, ack 1, win 2048, options [nop,nop,TS val 1330161955 ecr 1488063891], length 1368
22:50:19.212944 IP 10.34.1.208.53645 > 172.217.9.138.443: Flags [.], seq 215322:216690, ack 1, win 2048, options [nop,nop,TS val 1330161955 ecr 1488063891], length 1368
22:50:19.212946 IP 10.34.1.208.53645 > 172.217.9.138.443: Flags [.], seq 216690:218058, ack 1, win 2048, options [nop,nop,TS val 1330161955 ecr 1488063891], length 1368
22:50:19.212947 IP 10.34.1.208.53645 > 172.217.9.138.443: Flags [.], seq 218058:219426, ack 1, win 2048, options [nop,nop,TS val 1330161955 ecr 1488063891], length 1368
22:50:19.212948 IP 10.34.1.208.53645 > 172.217.9.138.443: Flags [.], seq 219426:220794, ack 1, win 2048, options [nop,nop,TS val 1330161955 ecr 1488063891], length 1368
22:50:19.212950 IP 10.34.1.208.53645 > 172.217.9.138.443: Flags [.], seq 220794:222162, ack 1, win 2048, options [nop,nop,TS val 1330161955 ecr 1488063891], length 1368
22:50:19.212950 IP 10.34.1.208.53645 > 172.217.9.138.443: Flags [P.], seq 222162:222183, ack 1, win 2048, options [nop,nop,TS val 1330161955 ecr 1488063891], length 21
22:50:19.216667 IP 10.34.1.208.53645 > 172.217.9.138.443: Flags [.], seq 222183:223551, ack 1, win 2048, options [nop,nop,TS val 1330161959 ecr 1488063892], length 1368
22:50:19.216673 IP 10.34.1.208.53645 > 172.217.9.138.443: Flags [.], seq 223551:224919, ack 1, win 2048, options [nop,nop,TS val 1330161959 ecr 1488063892], length 1368
22:50:19.216674 IP 10.34.1.208.53645 > 172.217.9.138.443: Flags [.], seq 224919:226287, ack 1, win 2048, options [nop,nop,TS val 1330161959 ecr 1488063892], length 1368
22:50:19.216676 IP 10.34.1.208.53645 > 172.217.9.138.443: Flags [.], seq 226287:227655, ack 1, win 2048, options [nop,nop,TS val 1330161959 ecr 1488063892], length 1368
22:50:19.216677 IP 10.34.1.208.53645 > 172.217.9.138.443: Flags [.], seq 227655:229023, ack 1, win 2048, options [nop,nop,TS val 1330161959 ecr 1488063892], length 1368
22:50:19.216678 IP 10.34.1.208.53645 > 172.217.9.138.443: Flags [.], seq 229023:230391, ack 1, win 2048, options [nop,nop,TS val 1330161959 ecr 1488063892], length 1368
22:50:19.216679 IP 10.34.1.208.53645 > 172.217.9.138.443: Flags [P.], seq 230391:230412, ack 1, win 2048, options [nop,nop,TS val 1330161959 ecr 1488063892], length 21
22:50:19.221121 IP 10.34.1.208.53645 > 172.217.9.138.443: Flags [.], seq 230412:231780, ack 1, win 2048, options [nop,nop,TS val 1330161963 ecr 1488063899], length 1368
22:50:19.221124 IP 10.34.1.208.53645 > 172.217.9.138.443: Flags [.], seq 231780:233148, ack 1, win 2048, options [nop,nop,TS val 1330161963 ecr 1488063899], length 1368
22:50:19.221125 IP 10.34.1.208.53645 > 172.217.9.138.443: Flags [.], seq 233148:234516, ack 1, win 2048, options [nop,nop,TS val 1330161963 ecr 1488063899], length 1368
22:50:19.221126 IP 10.34.1.208.53645 > 172.217.9.138.443: Flags [.], seq 234516:235884, ack 1, win 2048, options [nop,nop,TS val 1330161963 ecr 1488063899], length 1368
22:50:19.221128 IP 10.34.1.208.53645 > 172.217.9.138.443: Flags [.], seq 235884:237252, ack 1, win 2048, options [nop,nop,TS val 1330161963 ecr 1488063899], length 1368
22:50:19.221128 IP 10.34.1.208.53645 > 172.217.9.138.443: Flags [.], seq 237252:238620, ack 1, win 2048, options [nop,nop,TS val 1330161963 ecr 1488063899], length 1368
22:50:19.221129 IP 10.34.1.208.53645 > 172.217.9.138.443: Flags [P.], seq 238620:238641, ack 1, win 2048, options [nop,nop,TS val 1330161963 ecr 1488063899], length 21
22:50:19.224939 IP 10.34.1.208.53645 > 172.217.9.138.443: Flags [.], seq 238641:240009, ack 1, win 2048, options [nop,nop,TS val 1330161966 ecr 1488063900], length 1368
22:50:19.224946 IP 10.34.1.208.53645 > 172.217.9.138.443: Flags [.], seq 240009:241377, ack 1, win 2048, options [nop,nop,TS val 1330161966 ecr 1488063900], length 1368
22:50:19.224948 IP 10.34.1.208.53645 > 172.217.9.138.443: Flags [.], seq 241377:242745, ack 1, win 2048, options [nop,nop,TS val 1330161966 ecr 1488063900], length 1368
22:50:19.224949 IP 10.34.1.208.53645 > 172.217.9.138.443: Flags [.], seq 242745:244113, ack 1, win 2048, options [nop,nop,TS val 1330161966 ecr 1488063900], length 1368
22:50:19.224951 IP 10.34.1.208.53645 > 172.217.9.138.443: Flags [.], seq 244113:245481, ack 1, win 2048, options [nop,nop,TS val 1330161966 ecr 1488063900], length 1368
22:50:19.224952 IP 10.34.1.208.53645 > 172.217.9.138.443: Flags [.], seq 245481:246849, ack 1, win 2048, options [nop,nop,TS val 1330161966 ecr 1488063900], length 1368
22:50:19.224953 IP 10.34.1.208.53645 > 172.217.9.138.443: Flags [P.], seq 246849:246870, ack 1, win 2048, options [nop,nop,TS val 1330161966 ecr 1488063900], length 21
22:50:19.233906 IP 10.34.1.208.53645 > 172.217.9.138.443: Flags [.], seq 246870:248238, ack 1, win 2048, options [nop,nop,TS val 1330161974 ecr 1488063908], length 1368
22:50:19.233911 IP 10.34.1.208.53645 > 172.217.9.138.443: Flags [.], seq 248238:249606, ack 1, win 2048, options [nop,nop,TS val 1330161974 ecr 1488063908], length 1368
22:50:19.233913 IP 10.34.1.208.53645 > 172.217.9.138.443: Flags [.], seq 249606:250974, ack 1, win 2048, options [nop,nop,TS val 1330161974 ecr 1488063908], length 1368
22:50:19.233914 IP 10.34.1.208.53645 > 172.217.9.138.443: Flags [.], seq 250974:252342, ack 1, win 2048, options [nop,nop,TS val 1330161974 ecr 1488063908], length 1368
22:50:19.233915 IP 10.34.1.208.53645 > 172.217.9.138.443: Flags [.], seq 252342:253710, ack 1, win 2048, options [nop,nop,TS val 1330161974 ecr 1488063908], length 1368
22:50:19.233916 IP 10.34.1.208.53645 > 172.217.9.138.443: Flags [.], seq 253710:255078, ack 1, win 2048, options [nop,nop,TS val 1330161974 ecr 1488063908], length 1368
22:50:19.233917 IP 10.34.1.208.53645 > 172.217.9.138.443: Flags [P.], seq 255078:255099, ack 1, win 2048, options [nop,nop,TS val 1330161974 ecr 1488063908], length 21
22:50:19.239279 IP 10.34.1.208.53645 > 172.217.9.138.443: Flags [.], seq 255099:256467, ack 1, win 2048, options [nop,nop,TS val 1330161978 ecr 1488063917], length 1368
22:50:19.239284 IP 10.34.1.208.53645 > 172.217.9.138.443: Flags [.], seq 256467:257835, ack 1, win 2048, options [nop,nop,TS val 1330161978 ecr 1488063917], length 1368
22:50:19.239285 IP 10.34.1.208.53645 > 172.217.9.138.443: Flags [.], seq 257835:259203, ack 1, win 2048, options [nop,nop,TS val 1330161978 ecr 1488063917], length 1368
22:50:19.239286 IP 10.34.1.208.53645 > 172.217.9.138.443: Flags [.], seq 259203:260571, ack 1, win 2048, options [nop,nop,TS val 1330161978 ecr 1488063917], length 1368
22:50:19.239287 IP 10.34.1.208.53645 > 172.217.9.138.443: Flags [.], seq 260571:261939, ack 1, win 2048, options [nop,nop,TS val 1330161978 ecr 1488063917], length 1368
22:50:19.239288 IP 10.34.1.208.53645 > 172.217.9.138.443: Flags [.], seq 261939:263307, ack 1, win 2048, options [nop,nop,TS val 1330161978 ecr 1488063917], length 1368
22:50:19.239290 IP 10.34.1.208.53645 > 172.217.9.138.443: Flags [P.], seq 263307:263328, ack 1, win 2048, options [nop,nop,TS val 1330161978 ecr 1488063917], length 21
22:50:19.241923 IP 10.34.1.208.53645 > 172.217.9.138.443: Flags [.], seq 263328:264696, ack 1, win 2048, options [nop,nop,TS val 1330161981 ecr 1488063918], length 1368
22:50:19.241929 IP 10.34.1.208.53645 > 172.217.9.138.443: Flags [.], seq 264696:266064, ack 1, win 2048, options [nop,nop,TS val 1330161981 ecr 1488063918], length 1368
22:50:19.241931 IP 10.34.1.208.53645 > 172.217.9.138.443: Flags [.], seq 266064:267432, ack 1, win 2048, options [nop,nop,TS val 1330161981 ecr 1488063918], length 1368
22:50:19.241932 IP 10.34.1.208.53645 > 172.217.9.138.443: Flags [.], seq 267432:268800, ack 1, win 2048, options [nop,nop,TS val 1330161981 ecr 1488063918], length 1368
22:50:19.241933 IP 10.34.1.208.53645 > 172.217.9.138.443: Flags [.], seq 268800:270168, ack 1, win 2048, options [nop,nop,TS val 1330161981 ecr 1488063918], length 1368
22:50:19.241934 IP 10.34.1.208.53645 > 172.217.9.138.443: Flags [.], seq 270168:271536, ack 1, win 2048, options [nop,nop,TS val 1330161981 ecr 1488063918], length 1368
22:50:19.241935 IP 10.34.1.208.53645 > 172.217.9.138.443: Flags [P.], seq 271536:271557, ack 1, win 2048, options [nop,nop,TS val 1330161981 ecr 1488063918], length 21
22:50:19.242481 IP 10.34.1.208.53645 > 172.217.9.138.443: Flags [.], seq 271557:272925, ack 1, win 2048, options [nop,nop,TS val 1330161981 ecr 1488063918], length 1368
22:50:19.242485 IP 10.34.1.208.53645 > 172.217.9.138.443: Flags [.], seq 272925:274293, ack 1, win 2048, options [nop,nop,TS val 1330161981 ecr 1488063918], length 1368
22:50:19.242486 IP 10.34.1.208.53645 > 172.217.9.138.443: Flags [.], seq 274293:275661, ack 1, win 2048, options [nop,nop,TS val 1330161981 ecr 1488063918], length 1368
22:50:19.242489 IP 10.34.1.208.53645 > 172.217.9.138.443: Flags [.], seq 275661:277029, ack 1, win 2048, options [nop,nop,TS val 1330161981 ecr 1488063918], length 1368
