16:24:40.372859 IP 10.34.181.62.50928 > 18.207.50.150.443: Flags [P.], seq 1343420749:1343420808, ack 1630714187, win 2048, options [nop,nop,TS val 460385584 ecr 1862953493], length 59
16:24:40.406752 IP 10.34.181.62.50928 > 18.207.50.150.443: Flags [.], ack 62, win 2047, options [nop,nop,TS val 460385617 ecr 1862954744], length 0
16:24:42.718550 IP 10.34.181.62.50924 > 10.38.159.210.8009: Flags [P.], seq 3145068239:3145068356, ack 855525080, win 2048, options [nop,nop,TS val 460387924 ecr 4722611], length 117
16:24:42.731669 IP 10.34.181.62.50923 > 10.38.159.196.8009: Flags [P.], seq 1165712205:1165712322, ack 4259779273, win 2048, options [nop,nop,TS val 460387937 ecr 4918289], length 117
16:24:42.735347 IP 10.34.181.62.50923 > 10.38.159.196.8009: Flags [.], ack 118, win 2046, options [nop,nop,TS val 460387940 ecr 4918790], length 0
16:24:42.735418 IP 10.34.181.62.50925 > 10.38.95.203.8009: Flags [P.], seq 3383419854:3383419971, ack 307792801, win 2048, options [nop,nop,TS val 460387940 ecr 13702798], length 117
16:24:42.739079 IP 10.34.181.62.50925 > 10.38.95.203.8009: Flags [.], ack 118, win 2046, options [nop,nop,TS val 460387943 ecr 13703299], length 0
16:24:42.750934 IP 10.34.181.62.50924 > 10.38.159.210.8009: Flags [.], ack 118, win 2046, options [nop,nop,TS val 460387954 ecr 4723114], length 0
16:24:42.877913 IP 10.34.181.62.50927 > 10.38.31.227.8009: Flags [P.], seq 3736360539:3736360656, ack 189588721, win 2048, options [nop,nop,TS val 460388080 ecr 4289785], length 117
16:24:42.880968 IP 10.34.181.62.50927 > 10.38.31.227.8009: Flags [.], ack 118, win 2046, options [nop,nop,TS val 460388083 ecr 4290285], length 0
16:24:43.139750 IP 10.34.181.62.50926 > 10.38.159.198.8009: Flags [P.], seq 1293085933:1293086050, ack 2772510452, win 2048, options [nop,nop,TS val 460388340 ecr 5123847], length 117
16:24:43.143186 IP 10.34.181.62.50926 > 10.38.159.198.8009: Flags [.], ack 118, win 2046, options [nop,nop,TS val 460388343 ecr 5124347], length 0
16:24:43.274480 IP 10.34.181.62.50934 > 10.38.95.213.8009: Flags [P.], seq 440682346:440682463, ack 3354748427, win 2048, options [nop,nop,TS val 460388474 ecr 4688048], length 117
16:24:43.280637 IP 10.34.181.62.50934 > 10.38.95.213.8009: Flags [.], ack 118, win 2046, options [nop,nop,TS val 460388480 ecr 4688549], length 0
16:24:43.577307 IP 10.34.181.62.50935 > 10.38.159.223.8009: Flags [P.], seq 1160394206:1160394323, ack 1767970278, win 2048, options [nop,nop,TS val 460388775 ecr 4402180], length 117
16:24:43.581470 IP 10.34.181.62.50935 > 10.38.159.223.8009: Flags [.], ack 118, win 2046, options [nop,nop,TS val 460388779 ecr 4402681], length 0
16:24:43.601961 IP 10.34.181.62.12449 > 138.237.48.113.53: 43316+ A? unix.stackexchange.com. (40)
16:24:43.602104 IP 10.34.181.62.9629 > 138.237.48.113.53: 60237+ A? sb.scorecardresearch.com. (42)
16:24:43.602236 IP 10.34.181.62.45971 > 138.237.48.113.53: 26821+ A? pixel.quantserve.com. (38)
16:24:43.606487 IP 10.34.181.62.50976 > 151.101.193.69.443: Flags [P.], seq 2280127898:2280128009, ack 3214894065, win 2048, options [nop,nop,TS val 460388803 ecr 746029544], length 111
16:24:43.606532 IP 10.34.181.62.50976 > 151.101.193.69.443: Flags [P.], seq 111:157, ack 1, win 2048, options [nop,nop,TS val 460388803 ecr 746029544], length 46
16:24:43.607702 IP 10.34.181.62.51004 > 52.218.241.184.443: Flags [R.], seq 3841186388, ack 1044535267, win 4095, length 0
16:24:43.607834 IP 10.34.181.62.51005 > 52.218.200.82.443: Flags [R.], seq 401440733, ack 2312967492, win 4095, length 0
16:24:43.608044 IP 10.34.181.62.51006 > 18.217.203.112.443: Flags [S], seq 2768123929, win 65535, options [mss 1460,nop,wscale 6,nop,nop,TS val 460388804 ecr 0,sackOK,eol], length 0
16:24:43.608220 IP 10.34.181.62.6172 > 138.237.48.113.53: 3145+ A? securepubads.g.doubleclick.net. (48)
16:24:43.608463 IP 10.34.181.62.64650 > 138.237.48.113.53: 46327+ A? clc.stackoverflow.com. (39)
16:24:43.615142 IP 10.34.181.62.54346 > 172.217.9.130.443: UDP, length 1350
16:24:43.615860 IP 10.34.181.62.51876 > 138.237.48.113.53: 59356+ A? www.gravatar.com. (34)
16:24:43.617203 IP 10.34.181.62.44610 > 138.237.48.113.53: 18838+ A? ajax.googleapis.com. (37)
16:24:43.617649 IP 10.34.181.62.65019 > 138.237.48.113.53: 39984+ A? i.stack.imgur.com. (35)
16:24:43.621145 IP 10.34.181.62.51007 > 192.0.73.2.443: Flags [S], seq 4077874045, win 65535, options [mss 1460,nop,wscale 6,nop,nop,TS val 460388817 ecr 0,sackOK,eol], length 0
16:24:43.621308 IP 10.34.181.62.50279 > 138.237.48.113.53: 10810+ A? www.googletagservices.com. (43)
16:24:43.621355 IP 10.34.181.62.50976 > 151.101.193.69.443: Flags [.], ack 47, win 2047, options [nop,nop,TS val 460388817 ecr 746033959], length 0
16:24:43.624912 IP 10.34.181.62.61580 > 172.217.9.138.443: UDP, length 1350
16:24:43.625076 IP 10.34.181.62.28295 > 138.237.48.113.53: 9196+ A? secure.quantserve.com. (39)
16:24:43.625696 IP 10.34.181.62.51008 > 104.16.28.34.443: Flags [S], seq 1122956935, win 65535, options [mss 1460,nop,wscale 6,nop,nop,TS val 460388821 ecr 0,sackOK,eol], length 0
16:24:43.625843 IP 10.34.181.62.59630 > 138.237.48.113.53: 25435+ A? adservice.google.com. (38)
16:24:43.626444 IP 10.34.181.62.54643 > 138.237.48.113.53: 3197+ A? googleads.g.doubleclick.net. (45)
16:24:43.626591 IP 10.34.181.62.40372 > 138.237.48.113.53: 6599+ A? www.google-analytics.com. (42)
16:24:43.627138 IP 10.34.181.62.51007 > 192.0.73.2.443: Flags [.], ack 1538392253, win 4096, length 0
16:24:43.627467 IP 10.34.181.62.51007 > 192.0.73.2.443: Flags [P.], seq 0:572, ack 1, win 4096, length 572
16:24:43.629647 IP 10.34.181.62.54346 > 172.217.9.130.443: UDP, length 39
16:24:43.629681 IP 10.34.181.62.54346 > 172.217.9.130.443: UDP, length 28
16:24:43.631669 IP 10.34.181.62.51008 > 104.16.28.34.443: Flags [.], ack 2125948445, win 4096, length 0
16:24:43.631910 IP 10.34.181.62.51008 > 104.16.28.34.443: Flags [P.], seq 0:517, ack 1, win 4096, length 517
16:24:43.635538 IP 10.34.181.62.55540 > 172.217.14.162.443: UDP, length 1350
16:24:43.637294 IP 10.34.181.62.63880 > 172.217.14.162.443: UDP, length 1350
16:24:43.637425 IP 10.34.181.62.51007 > 192.0.73.2.443: Flags [.], ack 235, win 4092, length 0
16:24:43.637457 IP 10.34.181.62.49823 > 138.237.48.113.53: 41328+ A? rules.quantcount.com. (38)
16:24:43.637721 IP 10.34.181.62.51009 > 18.217.76.121.443: Flags [S], seq 2399953243, win 65535, options [mss 1460,nop,wscale 6,nop,nop,TS val 460388831 ecr 0,sackOK,eol], length 0
16:24:43.639128 IP 10.34.181.62.52779 > 172.217.9.142.443: UDP, length 1350
16:24:43.639494 IP 10.34.181.62.51007 > 192.0.73.2.443: Flags [P.], seq 572:636, ack 235, win 4096, length 64
16:24:43.642049 IP 10.34.181.62.51006 > 18.217.203.112.443: Flags [.], ack 1010533811, win 2058, options [nop,nop,TS val 460388834 ecr 425259478], length 0
16:24:43.642050 IP 10.34.181.62.51008 > 104.16.28.34.443: Flags [.], ack 157, win 4093, length 0
16:24:43.642443 IP 10.34.181.62.61580 > 172.217.9.138.443: UDP, length 39
16:24:43.642490 IP 10.34.181.62.61580 > 172.217.9.138.443: UDP, length 28
16:24:43.642635 IP 10.34.181.62.51008 > 104.16.28.34.443: Flags [P.], seq 517:568, ack 157, win 4096, length 51
16:24:43.643691 IP 10.34.181.62.51006 > 18.217.203.112.443: Flags [P.], seq 0:517, ack 1, win 2058, options [nop,nop,TS val 460388835 ecr 425259478], length 517
16:24:43.644143 IP 10.34.181.62.51010 > 54.192.7.35.443: Flags [S], seq 1159099590, win 65535, options [mss 1460,nop,wscale 6,nop,nop,TS val 460388835 ecr 0,sackOK,eol], length 0
16:24:43.645291 IP 10.34.181.62.51007 > 192.0.73.2.443: Flags [.], ack 297, win 4095, length 0
16:24:43.647220 IP 10.34.181.62.51008 > 104.16.28.34.443: Flags [.], ack 226, win 4094, length 0
16:24:43.648037 IP 10.34.181.62.51010 > 54.192.7.35.443: Flags [.], ack 2419099110, win 2058, options [nop,nop,TS val 460388837 ecr 957438944], length 0
16:24:43.648246 IP 10.34.181.62.51010 > 54.192.7.35.443: Flags [P.], seq 0:517, ack 1, win 2058, options [nop,nop,TS val 460388838 ecr 957438944], length 517
16:24:43.650277 IP 10.34.181.62.55540 > 172.217.14.162.443: UDP, length 39
16:24:43.650330 IP 10.34.181.62.55540 > 172.217.14.162.443: UDP, length 28
16:24:43.651723 IP 10.34.181.62.63880 > 172.217.14.162.443: UDP, length 39
16:24:43.651757 IP 10.34.181.62.63880 > 172.217.14.162.443: UDP, length 28
16:24:43.653128 IP 10.34.181.62.52779 > 172.217.9.142.443: UDP, length 39
16:24:43.653162 IP 10.34.181.62.52779 > 172.217.9.142.443: UDP, length 28
16:24:43.669578 IP 10.34.181.62.51009 > 18.217.76.121.443: Flags [.], ack 4247301703, win 2058, options [nop,nop,TS val 460388858 ecr 2413233968], length 0
16:24:43.669877 IP 10.34.181.62.51009 > 18.217.76.121.443: Flags [P.], seq 0:517, ack 1, win 2058, options [nop,nop,TS val 460388858 ecr 2413233968], length 517
16:24:43.671107 IP 10.34.181.62.50976 > 151.101.193.69.443: Flags [.], ack 347, win 2043, options [nop,nop,TS val 460388859 ecr 746033971], length 0
16:24:43.673344 IP 10.34.181.62.50976 > 151.101.193.69.443: Flags [.], ack 3135, win 2004, options [nop,nop,TS val 460388861 ecr 746033971], length 0
16:24:43.673344 IP 10.34.181.62.50976 > 151.101.193.69.443: Flags [.], ack 5923, win 1960, options [nop,nop,TS val 460388861 ecr 746033971], length 0
16:24:43.673379 IP 10.34.181.62.50976 > 151.101.193.69.443: Flags [.], ack 5923, win 1960, options [nop,nop,TS val 460388861 ecr 746033971,nop,nop,sack 1 {7371:8711}], length 0
16:24:43.673379 IP 10.34.181.62.50976 > 151.101.193.69.443: Flags [.], ack 8711, win 1917, options [nop,nop,TS val 460388861 ecr 746033971], length 0
16:24:43.673379 IP 10.34.181.62.50976 > 151.101.193.69.443: Flags [.], ack 11499, win 1873, options [nop,nop,TS val 460388861 ecr 746033971], length 0
16:24:43.673380 IP 10.34.181.62.50976 > 151.101.193.69.443: Flags [.], ack 14287, win 1830, options [nop,nop,TS val 460388861 ecr 746033971], length 0
16:24:43.673391 IP 10.34.181.62.50976 > 151.101.193.69.443: Flags [.], ack 16905, win 1789, options [nop,nop,TS val 460388861 ecr 746033971], length 0
16:24:43.673396 IP 10.34.181.62.50976 > 151.101.193.69.443: Flags [.], ack 16905, win 1789, options [nop,nop,TS val 460388861 ecr 746033971,nop,nop,sack 1 {18353:19693}], length 0
16:24:43.673554 IP 10.34.181.62.50976 > 151.101.193.69.443: Flags [.], ack 16905, win 2048, options [nop,nop,TS val 460388861 ecr 746033971,nop,nop,sack 1 {18353:19693}], length 0
16:24:43.673554 IP 10.34.181.62.50976 > 151.101.193.69.443: Flags [.], ack 19693, win 2004, options [nop,nop,TS val 460388861 ecr 746033971], length 0
16:24:43.673554 IP 10.34.181.62.50976 > 151.101.193.69.443: Flags [.], ack 19693, win 2004, options [nop,nop,TS val 460388861 ecr 746033971,nop,nop,sack 1 {21141:22481}], length 0
16:24:43.673555 IP 10.34.181.62.50976 > 151.101.193.69.443: Flags [.], ack 22481, win 1960, options [nop,nop,TS val 460388861 ecr 746033971], length 0
16:24:43.673555 IP 10.34.181.62.50976 > 151.101.193.69.443: Flags [.], ack 22481, win 2048, options [nop,nop,TS val 460388861 ecr 746033971], length 0
16:24:43.673555 IP 10.34.181.62.50976 > 151.101.193.69.443: Flags [.], ack 25058, win 2007, options [nop,nop,TS val 460388861 ecr 746033971], length 0
16:24:43.677654 IP 10.34.181.62.51010 > 54.192.7.35.443: Flags [.], ack 147, win 2056, options [nop,nop,TS val 460388864 ecr 957438947], length 0
16:24:43.677782 IP 10.34.181.62.51010 > 54.192.7.35.443: Flags [P.], seq 517:568, ack 147, win 2056, options [nop,nop,TS val 460388864 ecr 957438947], length 51
16:24:43.682828 IP 10.34.181.62.51006 > 18.217.203.112.443: Flags [.], ack 1449, win 2048, options [nop,nop,TS val 460388868 ecr 425259499,nop,nop,sack 1 {2897:3382}], length 0
16:24:43.682828 IP 10.34.181.62.51006 > 18.217.203.112.443: Flags [.], ack 3382, win 2017, options [nop,nop,TS val 460388868 ecr 425259499], length 0
16:24:43.683444 IP 10.34.181.62.51006 > 18.217.203.112.443: Flags [P.], seq 517:643, ack 3382, win 2048, options [nop,nop,TS val 460388868 ecr 425259499], length 126
16:24:43.686266 IP 10.34.181.62.50996 > 198.252.206.25.443: Flags [P.], seq 2780745820:2780745857, ack 1866802054, win 2054, options [nop,nop,TS val 460388871 ecr 271826], length 37
16:24:43.686422 IP 10.34.181.62.50996 > 198.252.206.25.443: Flags [F.], seq 37, ack 1, win 2054, options [nop,nop,TS val 460388871 ecr 271826], length 0
16:24:43.688841 IP 10.34.181.62.51010 > 54.192.7.35.443: Flags [.], ack 216, win 2055, options [nop,nop,TS val 460388872 ecr 957438948], length 0
16:24:43.704811 IP 10.34.181.62.50976 > 151.101.193.69.443: Flags [.], ack 27846, win 2004, options [nop,nop,TS val 460388888 ecr 746033980], length 0
16:24:43.704812 IP 10.34.181.62.50976 > 151.101.193.69.443: Flags [.], ack 27934, win 2003, options [nop,nop,TS val 460388888 ecr 746033980], length 0
16:24:43.704812 IP 10.34.181.62.50976 > 151.101.193.69.443: Flags [.], ack 29372, win 1980, options [nop,nop,TS val 460388888 ecr 746033980], length 0
16:24:43.704812 IP 10.34.181.62.50976 > 151.101.193.69.443: Flags [.], ack 32160, win 1937, options [nop,nop,TS val 460388888 ecr 746033980], length 0
16:24:43.704813 IP 10.34.181.62.50976 > 151.101.193.69.443: Flags [.], ack 32239, win 1935, options [nop,nop,TS val 460388888 ecr 746033980], length 0
16:24:43.704813 IP 10.34.181.62.50976 > 151.101.193.69.443: Flags [.], ack 33261, win 1919, options [nop,nop,TS val 460388888 ecr 746033980], length 0
16:24:43.704813 IP 10.34.181.62.50976 > 151.101.193.69.443: Flags [.], ack 34699, win 1897, options [nop,nop,TS val 460388888 ecr 746033980], length 0
16:24:43.704813 IP 10.34.181.62.50976 > 151.101.193.69.443: Flags [.], ack 37487, win 1853, options [nop,nop,TS val 460388888 ecr 746033980], length 0
16:24:43.704814 IP 10.34.181.62.50976 > 151.101.193.69.443: Flags [.], ack 37487, win 1853, options [nop,nop,TS val 460388888 ecr 746033980,nop,nop,sack 1 {38935:38966}], length 0
16:24:43.704814 IP 10.34.181.62.50976 > 151.101.193.69.443: Flags [.], ack 38966, win 1830, options [nop,nop,TS val 460388888 ecr 746033980], length 0
16:24:43.704814 IP 10.34.181.62.50976 > 151.101.193.69.443: Flags [.], ack 40404, win 1808, options [nop,nop,TS val 460388888 ecr 746033980], length 0
16:24:43.704814 IP 10.34.181.62.50976 > 151.101.193.69.443: Flags [.], ack 41781, win 1786, options [nop,nop,TS val 460388888 ecr 746033980], length 0
16:24:43.706239 IP 10.34.181.62.50976 > 151.101.193.69.443: Flags [.], ack 41781, win 2048, options [nop,nop,TS val 460388889 ecr 746033980], length 0
16:24:43.708652 IP 10.34.181.62.51009 > 18.217.76.121.443: Flags [.], ack 1449, win 2036, options [nop,nop,TS val 460388891 ecr 2413233977,nop,nop,sack 1 {2897:3382}], length 0
16:24:43.708653 IP 10.34.181.62.51009 > 18.217.76.121.443: Flags [.], ack 3382, win 2006, options [nop,nop,TS val 460388891 ecr 2413233977], length 0
16:24:43.713400 IP 10.34.181.62.51009 > 18.217.76.121.443: Flags [P.], seq 517:643, ack 3382, win 2048, options [nop,nop,TS val 460388895 ecr 2413233977], length 126
16:24:43.715188 IP 10.34.181.62.51006 > 18.217.203.112.443: Flags [.], ack 3433, win 2047, options [nop,nop,TS val 460388897 ecr 425259509], length 0
16:24:43.733560 IP 10.34.181.62.51007 > 192.0.73.2.443: Flags [P.], seq 636:722, ack 297, win 4095, length 86
16:24:43.734478 IP 10.34.181.62.51007 > 192.0.73.2.443: Flags [P.], seq 722:753, ack 297, win 4096, length 31
16:24:43.734672 IP 10.34.181.62.51007 > 192.0.73.2.443: Flags [P.], seq 753:1096, ack 297, win 4096, length 343
16:24:43.734889 IP 10.34.181.62.51007 > 192.0.73.2.443: Flags [P.], seq 1096:1220, ack 297, win 4096, length 124
16:24:43.737829 IP 10.34.181.62.51007 > 192.0.73.2.443: Flags [.], ack 328, win 4095, length 0
16:24:43.738810 IP 10.34.181.62.50996 > 198.252.206.25.443: Flags [R], seq 2780745858, win 0, length 0
16:24:43.740084 IP 10.34.181.62.50996 > 198.252.206.25.443: Flags [R], seq 2780745858, win 0, length 0
16:24:43.740135 IP 10.34.181.62.51007 > 192.0.73.2.443: Flags [.], ack 615, win 4091, length 0
16:24:43.740136 IP 10.34.181.62.51007 > 192.0.73.2.443: Flags [.], ack 781, win 4088, length 0
16:24:43.745029 IP 10.34.181.62.51009 > 18.217.76.121.443: Flags [.], ack 3433, win 2047, options [nop,nop,TS val 460388925 ecr 2413233987], length 0
16:24:43.811731 IP 10.34.181.62.51007 > 192.0.73.2.443: Flags [P.], seq 1220:1320, ack 781, win 4096, length 100
16:24:43.816331 IP 10.34.181.62.51007 > 192.0.73.2.443: Flags [.], ack 912, win 4093, length 0
16:24:44.261663 IP 10.34.181.62.5353 > 224.0.0.251.5353: 40331 PTR (QM)? _arduino._tcp.local. (37)
16:24:44.907413 IP 10.34.181.62.54397 > 138.237.48.113.53: 16061+ A? geo.yahoo.com. (31)
16:24:44.913464 IP 10.34.181.62.51011 > 98.138.49.71.443: Flags [S], seq 1227765118, win 65535, options [mss 1460,nop,wscale 6,nop,nop,TS val 460390091 ecr 0,sackOK,eol], length 0
16:24:44.943700 IP 10.34.181.62.51011 > 98.138.49.71.443: Flags [.], ack 121241228, win 2058, options [nop,nop,TS val 460390121 ecr 3340994475], length 0
16:24:44.943955 IP 10.34.181.62.51011 > 98.138.49.71.443: Flags [P.], seq 0:517, ack 1, win 2058, options [nop,nop,TS val 460390121 ecr 3340994475], length 517
16:24:44.980549 IP 10.34.181.62.51011 > 98.138.49.71.443: Flags [.], ack 2897, win 2025, options [nop,nop,TS val 460390156 ecr 3340994507], length 0
16:24:44.981924 IP 10.34.181.62.51011 > 98.138.49.71.443: Flags [.], ack 4097, win 2029, options [nop,nop,TS val 460390157 ecr 3340994507], length 0
16:24:44.984414 IP 10.34.181.62.51011 > 98.138.49.71.443: Flags [.], ack 6831, win 2027, options [nop,nop,TS val 460390159 ecr 3340994512], length 0
16:24:44.985123 IP 10.34.181.62.51011 > 98.138.49.71.443: Flags [P.], seq 517:643, ack 6831, win 2048, options [nop,nop,TS val 460390159 ecr 3340994512], length 126
16:24:45.017981 IP 10.34.181.62.51011 > 98.138.49.71.443: Flags [.], ack 7105, win 2043, options [nop,nop,TS val 460390192 ecr 3340994548], length 0
16:24:45.018319 IP 10.34.181.62.51011 > 98.138.49.71.443: Flags [.], ack 7143, win 2043, options [nop,nop,TS val 460390192 ecr 3340994548], length 0
16:24:45.018540 IP 10.34.181.62.51011 > 98.138.49.71.443: Flags [.], ack 7193, win 2042, options [nop,nop,TS val 460390192 ecr 3340994548], length 0
16:24:45.018541 IP 10.34.181.62.51011 > 98.138.49.71.443: Flags [.], ack 7226, win 2041, options [nop,nop,TS val 460390192 ecr 3340994548], length 0
16:24:45.042154 IP 10.34.181.62.51011 > 98.138.49.71.443: Flags [P.], seq 643:736, ack 7226, win 2041, options [nop,nop,TS val 460390216 ecr 3340994548], length 93
16:24:45.042372 IP 10.34.181.62.51011 > 98.138.49.71.443: Flags [P.], seq 736:774, ack 7226, win 2048, options [nop,nop,TS val 460390216 ecr 3340994548], length 38
16:24:45.042525 IP 10.34.181.62.51011 > 98.138.49.71.443: Flags [.], seq 774:2222, ack 7226, win 2048, options [nop,nop,TS val 460390216 ecr 3340994548], length 1448
16:24:45.042526 IP 10.34.181.62.51011 > 98.138.49.71.443: Flags [P.], seq 2222:2351, ack 7226, win 2048, options [nop,nop,TS val 460390216 ecr 3340994548], length 129
16:24:45.071686 IP 10.34.181.62.51011 > 98.138.49.71.443: Flags [.], ack 7264, win 2047, options [nop,nop,TS val 460390245 ecr 3340994604], length 0
16:24:45.077108 IP 10.34.181.62.51011 > 98.138.49.71.443: Flags [.], ack 7302, win 2047, options [nop,nop,TS val 460390250 ecr 3340994609], length 0
16:24:45.077109 IP 10.34.181.62.51011 > 98.138.49.71.443: Flags [.], ack 7938, win 2037, options [nop,nop,TS val 460390250 ecr 3340994609], length 0
16:24:45.077109 IP 10.34.181.62.51011 > 98.138.49.71.443: Flags [.], ack 8010, win 2036, options [nop,nop,TS val 460390250 ecr 3340994609], length 0
16:24:45.259331 IP 10.34.181.62.50981 > 23.67.240.101.443: Flags [P.], seq 2459448529:2459449344, ack 2820547736, win 2048, options [nop,nop,TS val 460390431 ecr 1881647238], length 815
16:24:45.264564 IP 10.34.181.62.50981 > 23.67.240.101.443: Flags [.], ack 278, win 2043, options [nop,nop,TS val 460390436 ecr 1881667163], length 0
16:24:45.320582 IP 10.34.181.62.25575 > 138.237.48.113.53: 26803+ A? qa.sockets.stackexchange.com. (46)
16:24:45.331245 IP 10.34.181.62.51012 > 198.252.206.25.443: Flags [S], seq 2299758215, win 65535, options [mss 1460,nop,wscale 6,nop,nop,TS val 460390501 ecr 0,sackOK,eol], length 0
16:24:45.351776 IP 10.34.181.62.50976 > 151.101.193.69.443: Flags [P.], seq 157:249, ack 41781, win 2048, options [nop,nop,TS val 460390521 ecr 746033980], length 92
16:24:45.376294 IP 10.34.181.62.51012 > 198.252.206.25.443: Flags [.], ack 3463507893, win 2058, options [nop,nop,TS val 460390545 ecr 291202], length 0
16:24:45.376843 IP 10.34.181.62.51012 > 198.252.206.25.443: Flags [P.], seq 0:517, ack 1, win 2058, options [nop,nop,TS val 460390545 ecr 291202], length 517
16:24:45.377948 IP 10.34.181.62.50928 > 18.207.50.150.443: Flags [P.], seq 59:118, ack 62, win 2048, options [nop,nop,TS val 460390546 ecr 1862954744], length 59
16:24:45.392777 IP 10.34.181.62.50976 > 151.101.193.69.443: Flags [.], ack 41995, win 2044, options [nop,nop,TS val 460390560 ecr 746034402], length 0
16:24:45.412034 IP 10.34.181.62.50928 > 18.207.50.150.443: Flags [.], ack 123, win 2047, options [nop,nop,TS val 460390578 ecr 1862955995], length 0
16:24:45.431118 IP 10.34.181.62.51012 > 198.252.206.25.443: Flags [.], ack 1449, win 2048, options [nop,nop,TS val 460390596 ecr 291253,nop,nop,sack 1 {2897:3110}], length 0
16:24:45.431302 IP 10.34.181.62.51012 > 198.252.206.25.443: Flags [.], ack 3110, win 2022, options [nop,nop,TS val 460390596 ecr 291253], length 0
16:24:45.432243 IP 10.34.181.62.51012 > 198.252.206.25.443: Flags [P.], seq 517:643, ack 3110, win 2048, options [nop,nop,TS val 460390597 ecr 291253], length 126
16:24:45.460621 IP 10.34.181.62.52779 > 172.217.9.142.443: UDP, length 848
16:24:45.460872 IP 10.34.181.62.51006 > 18.217.203.112.443: Flags [P.], seq 643:2040, ack 3433, win 2048, options [nop,nop,TS val 460390625 ecr 425259509], length 1397
16:24:45.478565 IP 10.34.181.62.51012 > 198.252.206.25.443: Flags [.], ack 3368, win 2043, options [nop,nop,TS val 460390642 ecr 291304], length 0
16:24:45.478960 IP 10.34.181.62.51012 > 198.252.206.25.443: Flags [P.], seq 643:1426, ack 3368, win 2048, options [nop,nop,TS val 460390642 ecr 291304], length 783
16:24:45.480427 IP 10.34.181.62.52779 > 172.217.9.142.443: UDP, length 28
16:24:45.496516 IP 10.34.181.62.51006 > 18.217.203.112.443: Flags [.], ack 3754, win 2042, options [nop,nop,TS val 460390659 ecr 425259954], length 0
16:24:45.525498 IP 10.34.181.62.51012 > 198.252.206.25.443: Flags [.], ack 3563, win 2044, options [nop,nop,TS val 460390687 ecr 291351], length 0
16:24:45.608590 IP 10.34.181.62.51012 > 198.252.206.25.443: Flags [P.], seq 1426:1514, ack 3563, win 2048, options [nop,nop,TS val 460390769 ecr 291351], length 88
16:24:45.608648 IP 10.34.181.62.51012 > 198.252.206.25.443: Flags [P.], seq 1514:1568, ack 3563, win 2048, options [nop,nop,TS val 460390769 ecr 291351], length 54
16:24:45.633396 IP 10.34.181.62.51011 > 98.138.49.71.443: Flags [P.], seq 2351:2953, ack 8010, win 2048, options [nop,nop,TS val 460390793 ecr 3340994609], length 602
16:24:45.670064 IP 10.34.181.62.51011 > 98.138.49.71.443: Flags [.], ack 8048, win 2047, options [nop,nop,TS val 460390828 ecr 3340995202], length 0
16:24:45.670064 IP 10.34.181.62.51011 > 98.138.49.71.443: Flags [.], ack 8234, win 2044, options [nop,nop,TS val 460390828 ecr 3340995202], length 0
16:24:45.670064 IP 10.34.181.62.51011 > 98.138.49.71.443: Flags [.], ack 8306, win 2043, options [nop,nop,TS val 460390828 ecr 3340995202], length 0
16:24:45.696817 IP 10.34.181.62.51011 > 98.138.49.71.443: Flags [P.], seq 2953:3556, ack 8306, win 2048, options [nop,nop,TS val 460390854 ecr 3340995202], length 603
16:24:45.710453 IP 10.34.181.62.51011 > 98.138.49.71.443: Flags [P.], seq 3556:4166, ack 8306, win 2048, options [nop,nop,TS val 460390867 ecr 3340995202], length 610
16:24:45.727886 IP 10.34.181.62.59905 > 138.237.48.113.53: 43338+ A? srv-2018-11-28-22.pixel.parsely.com. (53)
16:24:45.733670 IP 10.34.181.62.51011 > 98.138.49.71.443: Flags [.], ack 8344, win 2047, options [nop,nop,TS val 460390889 ecr 3340995265], length 0
16:24:45.733671 IP 10.34.181.62.51011 > 98.138.49.71.443: Flags [.], ack 8530, win 2044, options [nop,nop,TS val 460390889 ecr 3340995266], length 0
16:24:45.733925 IP 10.34.181.62.51011 > 98.138.49.71.443: Flags [.], ack 8602, win 2046, options [nop,nop,TS val 460390889 ecr 3340995266], length 0
16:24:45.739868 IP 10.34.181.62.51013 > 34.199.223.198.443: Flags [S], seq 1396807866, win 65535, options [mss 1460,nop,wscale 6,nop,nop,TS val 460390894 ecr 0,sackOK,eol], length 0
16:24:45.747955 IP 10.34.181.62.36411 > 138.237.48.113.53: 27933+ A? techcrunch.com. (32)
16:24:45.749481 IP 10.34.181.62.51011 > 98.138.49.71.443: Flags [.], ack 8640, win 2047, options [nop,nop,TS val 460390903 ecr 3340995279], length 0
16:24:45.749516 IP 10.34.181.62.8887 > 138.237.48.113.53: 63906+ A? api-v3.tinypass.com. (37)
16:24:45.749741 IP 10.34.181.62.51011 > 98.138.49.71.443: Flags [.], ack 8825, win 2044, options [nop,nop,TS val 460390903 ecr 3340995279], length 0
16:24:45.749741 IP 10.34.181.62.51011 > 98.138.49.71.443: Flags [.], ack 8897, win 2043, options [nop,nop,TS val 460390903 ecr 3340995279], length 0
16:24:45.754158 IP 10.34.181.62.51014 > 104.16.76.51.443: Flags [S], seq 2429990, win 65535, options [mss 1460,nop,wscale 6,nop,nop,TS val 460390907 ecr 0,sackOK,eol], length 0
16:24:45.755330 IP 10.34.181.62.51015 > 192.0.66.2.443: Flags [S], seq 4062467321, win 65535, options [mss 1460,nop,wscale 6,nop,nop,TS val 460390908 ecr 0,sackOK,eol], length 0
16:24:45.758701 IP 10.34.181.62.51014 > 104.16.76.51.443: Flags [.], ack 139378013, win 4096, length 0
16:24:45.759079 IP 10.34.181.62.51014 > 104.16.76.51.443: Flags [P.], seq 0:559, ack 1, win 4096, length 559
16:24:45.760494 IP 10.34.181.62.51015 > 192.0.66.2.443: Flags [.], ack 2421286765, win 4096, length 0
16:24:45.760708 IP 10.34.181.62.51015 > 192.0.66.2.443: Flags [P.], seq 0:517, ack 1, win 4096, length 517
16:24:45.766671 IP 10.34.181.62.51014 > 104.16.76.51.443: Flags [.], ack 213, win 4092, length 0
16:24:45.767231 IP 10.34.181.62.51014 > 104.16.76.51.443: Flags [P.], seq 559:623, ack 213, win 4096, length 64
16:24:45.771736 IP 10.34.181.62.51015 > 192.0.66.2.443: Flags [.], ack 1461, win 4073, options [nop,nop,sack 1 {2921:3331}], length 0
16:24:45.771802 IP 10.34.181.62.51015 > 192.0.66.2.443: Flags [.], ack 3331, win 4043, length 0
16:24:45.772303 IP 10.34.181.62.51015 > 192.0.66.2.443: Flags [.], ack 3331, win 4096, length 0
16:24:45.772304 IP 10.34.181.62.51014 > 104.16.76.51.443: Flags [.], ack 663, win 4088, length 0
16:24:45.772547 IP 10.34.181.62.51014 > 104.16.76.51.443: Flags [.], ack 725, win 4088, length 0
16:24:45.772729 IP 10.34.181.62.51015 > 192.0.66.2.443: Flags [P.], seq 517:581, ack 3331, win 4096, length 64
16:24:45.773987 IP 10.34.181.62.51013 > 34.199.223.198.443: Flags [.], ack 2601113429, win 2058, options [nop,nop,TS val 460390923 ecr 1989846061], length 0
16:24:45.774263 IP 10.34.181.62.51013 > 34.199.223.198.443: Flags [P.], seq 0:517, ack 1, win 2058, options [nop,nop,TS val 460390923 ecr 1989846061], length 517
16:24:45.777965 IP 10.34.181.62.51015 > 192.0.66.2.443: Flags [.], ack 3602, win 4091, length 0
16:24:45.778059 IP 10.34.181.62.51015 > 192.0.66.2.443: Flags [.], ack 3873, win 4087, length 0
16:24:45.778060 IP 10.34.181.62.51015 > 192.0.66.2.443: Flags [.], ack 3935, win 4086, length 0
16:24:45.781118 IP 10.34.181.62.51014 > 104.16.76.51.443: Flags [P.], seq 623:709, ack 725, win 4088, length 86
16:24:45.781423 IP 10.34.181.62.51014 > 104.16.76.51.443: Flags [P.], seq 709:740, ack 725, win 4096, length 31
16:24:45.781580 IP 10.34.181.62.51014 > 104.16.76.51.443: Flags [P.], seq 740:1615, ack 725, win 4096, length 875
16:24:45.784569 IP 10.34.181.62.51014 > 104.16.76.51.443: Flags [.], ack 756, win 4095, length 0
16:24:45.790288 IP 10.34.181.62.51015 > 192.0.66.2.443: Flags [P.], seq 581:667, ack 3935, win 4086, length 86
16:24:45.790440 IP 10.34.181.62.51015 > 192.0.66.2.443: Flags [P.], seq 667:698, ack 3935, win 4096, length 31
16:24:45.790584 IP 10.34.181.62.51015 > 192.0.66.2.443: Flags [.], seq 698:2158, ack 3935, win 4096, length 1460
16:24:45.790587 IP 10.34.181.62.51015 > 192.0.66.2.443: Flags [P.], seq 2158:3008, ack 3935, win 4096, length 850
16:24:45.794519 IP 10.34.181.62.51015 > 192.0.66.2.443: Flags [.], ack 3966, win 4095, length 0
16:24:45.812904 IP 10.34.181.62.51013 > 34.199.223.198.443: Flags [.], ack 2897, win 2013, options [nop,nop,TS val 460390958 ecr 1989846070], length 0
16:24:45.812905 IP 10.34.181.62.51013 > 34.199.223.198.443: Flags [.], ack 4097, win 1994, options [nop,nop,TS val 460390958 ecr 1989846070], length 0
16:24:45.812998 IP 10.34.181.62.51013 > 34.199.223.198.443: Flags [.], ack 4097, win 2048, options [nop,nop,TS val 460390958 ecr 1989846070], length 0
16:24:45.813257 IP 10.34.181.62.51013 > 34.199.223.198.443: Flags [.], ack 5036, win 2033, options [nop,nop,TS val 460390958 ecr 1989846070], length 0
16:24:45.813720 IP 10.34.181.62.51013 > 34.199.223.198.443: Flags [P.], seq 517:643, ack 5036, win 2048, options [nop,nop,TS val 460390958 ecr 1989846070], length 126
16:24:45.833595 IP 10.34.181.62.51014 > 104.16.76.51.443: Flags [.], ack 1159, win 4089, length 0
16:24:45.833767 IP 10.34.181.62.51014 > 104.16.76.51.443: Flags [.], ack 1190, win 4095, length 0
16:24:45.848403 IP 10.34.181.62.51013 > 34.199.223.198.443: Flags [.], ack 5087, win 2047, options [nop,nop,TS val 460390991 ecr 1989846080], length 0
16:24:45.853288 IP 10.34.181.62.50976 > 151.101.193.69.443: Flags [P.], seq 249:405, ack 41995, win 2048, options [nop,nop,TS val 460390995 ecr 746034402], length 156
16:24:45.856869 IP 10.34.181.62.51013 > 34.199.223.198.443: Flags [P.], seq 643:1455, ack 5087, win 2048, options [nop,nop,TS val 460390998 ecr 1989846080], length 812
16:24:45.866159 IP 10.34.181.62.50976 > 151.101.193.69.443: Flags [P.], seq 405:516, ack 41995, win 2048, options [nop,nop,TS val 460391007 ecr 746034402], length 111
16:24:45.869950 IP 10.34.181.62.50976 > 151.101.193.69.443: Flags [.], ack 44783, win 2004, options [nop,nop,TS val 460391010 ecr 746034521], length 0
16:24:45.870184 IP 10.34.181.62.50976 > 151.101.193.69.443: Flags [.], ack 47571, win 2004, options [nop,nop,TS val 460391010 ecr 746034521], length 0
16:24:45.870420 IP 10.34.181.62.50976 > 151.101.193.69.443: Flags [.], ack 47661, win 2046, options [nop,nop,TS val 460391010 ecr 746034521], length 0
16:24:45.892117 IP 10.34.181.62.51013 > 34.199.223.198.443: Flags [.], ack 5345, win 2043, options [nop,nop,TS val 460391032 ecr 1989846090], length 0
16:24:45.984913 IP 10.34.181.62.50976 > 151.101.193.69.443: Flags [.], ack 47661, win 2048, options [nop,nop,TS val 460391123 ecr 746034521,nop,nop,sack 1 {49109:49410}], length 0
16:24:45.984914 IP 10.34.181.62.50976 > 151.101.193.69.443: Flags [.], ack 49410, win 2020, options [nop,nop,TS val 460391123 ecr 746034550], length 0
16:24:45.994238 IP 10.34.181.62.51008 > 104.16.28.34.443: Flags [P.], seq 568:661, ack 226, win 4094, length 93
16:24:45.994479 IP 10.34.181.62.51008 > 104.16.28.34.443: Flags [P.], seq 661:699, ack 226, win 4096, length 38
16:24:45.994670 IP 10.34.181.62.51008 > 104.16.28.34.443: Flags [P.], seq 699:1565, ack 226, win 4096, length 866
16:24:45.995645 IP 10.34.181.62.51008 > 104.16.28.34.443: Flags [P.], seq 1565:1641, ack 226, win 4096, length 76
16:24:45.997077 IP 10.34.181.62.50976 > 151.101.193.69.443: Flags [P.], seq 516:674, ack 49410, win 2048, options [nop,nop,TS val 460391134 ecr 746034550], length 158
16:24:45.997471 IP 10.34.181.62.51008 > 104.16.28.34.443: Flags [.], ack 264, win 4095, length 0
16:24:46.041602 IP 10.34.181.62.50976 > 151.101.193.69.443: Flags [.], ack 49618, win 2044, options [nop,nop,TS val 460391176 ecr 746034564], length 0
16:24:46.055507 IP 10.34.181.62.51008 > 104.16.28.34.443: Flags [.], ack 1662, win 4074, length 0
16:24:46.055711 IP 10.34.181.62.51008 > 104.16.28.34.443: Flags [.], ack 3060, win 4074, length 0
16:24:46.055746 IP 10.34.181.62.51008 > 104.16.28.34.443: Flags [.], ack 4458, win 4052, length 0
16:24:46.056559 IP 10.34.181.62.51008 > 104.16.28.34.443: Flags [.], ack 5856, win 4074, length 0
16:24:46.056560 IP 10.34.181.62.51008 > 104.16.28.34.443: Flags [.], ack 5856, win 4074, options [nop,nop,sack 1 {7316:8652}], length 0
16:24:46.056591 IP 10.34.181.62.51008 > 104.16.28.34.443: Flags [.], ack 8652, win 4030, length 0
16:24:46.056591 IP 10.34.181.62.51008 > 104.16.28.34.443: Flags [.], ack 10050, win 4008, length 0
16:24:46.056591 IP 10.34.181.62.51008 > 104.16.28.34.443: Flags [.], ack 11448, win 3986, length 0
16:24:46.056601 IP 10.34.181.62.51008 > 104.16.28.34.443: Flags [.], ack 12846, win 3964, length 0
16:24:46.056610 IP 10.34.181.62.51008 > 104.16.28.34.443: Flags [.], ack 14244, win 3943, length 0
16:24:46.056618 IP 10.34.181.62.51008 > 104.16.28.34.443: Flags [.], ack 15642, win 3921, length 0
16:24:46.056650 IP 10.34.181.62.51008 > 104.16.28.34.443: Flags [.], ack 17941, win 3885, length 0
16:24:46.056828 IP 10.34.181.62.51008 > 104.16.28.34.443: Flags [.], ack 17941, win 4096, length 0
16:24:46.056838 IP 10.34.181.62.51008 > 104.16.28.34.443: Flags [.], ack 17941, win 4096, options [nop,nop,sack 1 {19401:20775}], length 0
16:24:46.056853 IP 10.34.181.62.51008 > 104.16.28.34.443: Flags [.], ack 20775, win 4051, length 0
16:24:46.056858 IP 10.34.181.62.51008 > 104.16.28.34.443: Flags [.], ack 23695, win 4006, length 0
16:24:46.056864 IP 10.34.181.62.51008 > 104.16.28.34.443: Flags [.], ack 25155, win 4096, length 0
16:24:46.056868 IP 10.34.181.62.51008 > 104.16.28.34.443: Flags [.], ack 27765, win 4055, length 0
16:24:46.057390 IP 10.34.181.62.51008 > 104.16.28.34.443: Flags [.], ack 30685, win 4050, length 0
16:24:46.057439 IP 10.34.181.62.51008 > 104.16.28.34.443: Flags [.], ack 30685, win 4096, length 0
16:24:46.058277 IP 10.34.181.62.51008 > 104.16.28.34.443: Flags [.], ack 33605, win 4050, length 0
16:24:46.058737 IP 10.34.181.62.51008 > 104.16.28.34.443: Flags [.], ack 36525, win 4004, length 0
16:24:46.058738 IP 10.34.181.62.51008 > 104.16.28.34.443: Flags [.], ack 39445, win 3959, length 0
16:24:46.058765 IP 10.34.181.62.51008 > 104.16.28.34.443: Flags [.], ack 42365, win 3913, length 0
16:24:46.058905 IP 10.34.181.62.51008 > 104.16.28.34.443: Flags [.], ack 42365, win 4096, length 0
16:24:46.062604 IP 10.34.181.62.51008 > 104.16.28.34.443: Flags [.], ack 45285, win 4050, length 0
16:24:46.062641 IP 10.34.181.62.51008 > 104.16.28.34.443: Flags [.], ack 46745, win 4096, length 0
16:24:46.062993 IP 10.34.181.62.51008 > 104.16.28.34.443: Flags [.], ack 49665, win 4050, length 0
16:24:46.062993 IP 10.34.181.62.51008 > 104.16.28.34.443: Flags [.], ack 52585, win 4004, length 0
16:24:46.063006 IP 10.34.181.62.51008 > 104.16.28.34.443: Flags [.], ack 55505, win 3959, length 0
16:24:46.063007 IP 10.34.181.62.51008 > 104.16.28.34.443: Flags [.], ack 57793, win 3923, length 0
16:24:46.063011 IP 10.34.181.62.51008 > 104.16.28.34.443: Flags [.], ack 57793, win 4096, length 0
16:24:46.133840 IP 10.34.181.62.51015 > 192.0.66.2.443: Flags [.], ack 5357, win 4074, length 0
16:24:46.133842 IP 10.34.181.62.51015 > 192.0.66.2.443: Flags [.], ack 6748, win 4052, length 0
16:24:46.133842 IP 10.34.181.62.51015 > 192.0.66.2.443: Flags [.], ack 6748, win 4052, options [nop,nop,sack 1 {9668:9669}], length 0
16:24:46.133969 IP 10.34.181.62.51015 > 192.0.66.2.443: Flags [.], ack 8208, win 4029, options [nop,nop,sack 1 {9668:9669}], length 0
16:24:46.133971 IP 10.34.181.62.51015 > 192.0.66.2.443: Flags [.], ack 9669, win 4006, length 0
16:24:46.133971 IP 10.34.181.62.51015 > 192.0.66.2.443: Flags [.], ack 12589, win 3961, length 0
16:24:46.133971 IP 10.34.181.62.51015 > 192.0.66.2.443: Flags [.], ack 14049, win 3938, options [nop,nop,sack 1 {15509:16624}], length 0
16:24:46.133972 IP 10.34.181.62.51015 > 192.0.66.2.443: Flags [.], ack 16624, win 3898, length 0
16:24:46.134517 IP 10.34.181.62.51015 > 192.0.66.2.443: Flags [.], ack 16624, win 4096, length 0
16:24:46.138045 IP 10.34.181.62.51015 > 192.0.66.2.443: Flags [.], ack 16655, win 4095, length 0
16:24:46.176350 IP 10.34.181.62.51015 > 192.0.66.2.443: Flags [.], ack 18046, win 4074, length 0
16:24:46.176350 IP 10.34.181.62.51015 > 192.0.66.2.443: Flags [.], ack 19437, win 4052, length 0
16:24:46.176622 IP 10.34.181.62.51015 > 192.0.66.2.443: Flags [.], ack 19437, win 4096, options [nop,nop,sack 1 {20897:21012}], length 0
16:24:46.176632 IP 10.34.181.62.51015 > 192.0.66.2.443: Flags [.], ack 21012, win 4071, length 0
16:24:46.176633 IP 10.34.181.62.51015 > 192.0.66.2.443: Flags [.], ack 21012, win 4071, options [nop,nop,sack 1 {22472:23650}], length 0
16:24:46.176962 IP 10.34.181.62.51015 > 192.0.66.2.443: Flags [.], ack 23650, win 4054, length 0
16:24:46.176962 IP 10.34.181.62.51015 > 192.0.66.2.443: Flags [.], ack 26432, win 4011, length 0
16:24:46.176972 IP 10.34.181.62.51015 > 192.0.66.2.443: Flags [.], ack 29352, win 3965, length 0
16:24:46.176972 IP 10.34.181.62.51015 > 192.0.66.2.443: Flags [.], ack 30605, win 3946, length 0
16:24:46.176976 IP 10.34.181.62.51015 > 192.0.66.2.443: Flags [.], ack 30782, win 3943, length 0
16:24:46.176980 IP 10.34.181.62.51015 > 192.0.66.2.443: Flags [.], ack 32173, win 3921, length 0
16:24:46.176986 IP 10.34.181.62.51015 > 192.0.66.2.443: Flags [.], ack 32173, win 4096, length 0
16:24:46.177003 IP 10.34.181.62.51015 > 192.0.66.2.443: Flags [.], ack 34955, win 4052, length 0
16:24:46.177004 IP 10.34.181.62.51015 > 192.0.66.2.443: Flags [.], ack 37875, win 4006, length 0
16:24:46.177016 IP 10.34.181.62.51015 > 192.0.66.2.443: Flags [.], ack 37875, win 4006, options [nop,nop,sack 1 {39335:40491}], length 0
16:24:46.177016 IP 10.34.181.62.51015 > 192.0.66.2.443: Flags [.], ack 40491, win 3966, length 0
16:24:46.177017 IP 10.34.181.62.51015 > 192.0.66.2.443: Flags [.], ack 40491, win 3966, options [nop,nop,sack 1 {41951:43273}], length 0
16:24:46.177024 IP 10.34.181.62.51015 > 192.0.66.2.443: Flags [.], ack 43273, win 3922, length 0
16:24:46.177070 IP 10.34.181.62.51015 > 192.0.66.2.443: Flags [.], ack 43273, win 4096, length 0
16:24:46.181235 IP 10.34.181.62.51015 > 192.0.66.2.443: Flags [.], ack 44732, win 4073, length 0
16:24:46.220657 IP 10.34.181.62.51015 > 192.0.66.2.443: Flags [.], ack 46123, win 4074, length 0
16:24:46.220658 IP 10.34.181.62.51015 > 192.0.66.2.443: Flags [.], ack 47514, win 4052, length 0
16:24:46.220927 IP 10.34.181.62.51015 > 192.0.66.2.443: Flags [.], ack 48974, win 4029, options [nop,nop,sack 1 {50434:51687}], length 0
16:24:46.220927 IP 10.34.181.62.51015 > 192.0.66.2.443: Flags [.], ack 51687, win 3987, length 0
16:24:46.220927 IP 10.34.181.62.51015 > 192.0.66.2.443: Flags [.], ack 54607, win 3941, length 0
16:24:46.220944 IP 10.34.181.62.51015 > 192.0.66.2.443: Flags [.], ack 57527, win 3896, length 0
16:24:46.220944 IP 10.34.181.62.51015 > 192.0.66.2.443: Flags [.], ack 58635, win 3878, length 0
16:24:46.220944 IP 10.34.181.62.51015 > 192.0.66.2.443: Flags [.], ack 58670, win 3878, length 0
16:24:46.221578 IP 10.34.181.62.51015 > 192.0.66.2.443: Flags [.], ack 61590, win 3832, length 0
16:24:46.221578 IP 10.34.181.62.51015 > 192.0.66.2.443: Flags [.], ack 62921, win 3811, length 0
16:24:46.221579 IP 10.34.181.62.51015 > 192.0.66.2.443: Flags [.], ack 64381, win 3788, options [nop,nop,sack 1 {65841:67172}], length 0
16:24:46.221597 IP 10.34.181.62.51015 > 192.0.66.2.443: Flags [.], ack 67172, win 3745, length 0
16:24:46.221597 IP 10.34.181.62.51015 > 192.0.66.2.443: Flags [.], ack 68632, win 3722, options [nop,nop,sack 1 {70092:70905}], length 0
16:24:46.221604 IP 10.34.181.62.51015 > 192.0.66.2.443: Flags [.], ack 70905, win 3687, length 0
16:24:46.221608 IP 10.34.181.62.51015 > 192.0.66.2.443: Flags [.], ack 72365, win 3664, options [nop,nop,sack 1 {73825:75156}], length 0
16:24:46.221801 IP 10.34.181.62.51015 > 192.0.66.2.443: Flags [.], ack 75156, win 3620, length 0
16:24:46.221802 IP 10.34.181.62.51015 > 192.0.66.2.443: Flags [.], ack 78076, win 3575, length 0
